domain, post_time, title, rank, subreddit, score, link, comments, submitter, timestamp
i.imgur.com, Wed Nov 26 13:25:31 2014 UTC, One of my more elderly customers gave me this because he knows that I love technology., 1, /r/funny, 5717, http://i.imgur.com/g5UCAeA.jpg, 932 comments, NeonNeologist, 2014-11-26 14:00:01
33.media.tumblr.com, Wed Nov 26 13:11:24 2014 UTC, Strong, 2, /r/gifs, 4956, http://33.media.tumblr.com/4bf0451c51ec6bc9324d2d469638f0dc/tumblr_nfmywn9AXm1s2yegdo1_400.gif, 450 comments, I_love_moo, 2014-11-26 14:00:01
decider.com, Wed Nov 26 14:53:32 2014 UTC, Everything new on Netflix Streaming for December 2014, 3, /r/movies, 3151, http://decider.com/2014/11/25/new-on-netflix-december/, 756 comments, bacon-lazer, 2014-11-26 14:00:01
i.imgur.com, Wed Nov 26 15:15:14 2014 UTC, Just got back from Afghanistan to see some weirdo taking a picture of my car, 4, /r/pics, 3095, http://i.imgur.com/LIdjw51.jpg, 486 comments, mediclees, 2014-11-26 14:00:01
youtube.com, Wed Nov 26 11:44:21 2014 UTC, If your car slides on ice do not do this., 5, /r/videos, 4052, http://www.youtube.com/attribution_link?a=nYOl-gqydp8&u=%2Fwatch%3Fv%3DwwjsHdv5hRw%26feature%3Dshare, 1645 comments, twixtwix, 2014-11-26 14:00:01
youtube.com, Wed Nov 26 12:19:52 2014 UTC, Forest ranger in GTA V is looking for that big case that will score him a promotion., 6, /r/gaming, 3395, https://www.youtube.com/watch?v=8duNSbt6VHs, 185 comments, Vummy, 2014-11-26 14:00:01
imgur.com, Wed Nov 26 11:22:23 2014 UTC, This tree still has its leaves because of the light shining on it., 7, /r/mildlyinteresting, 4039, http://imgur.com/Z5Tl6V0, 259 comments, FlyinAjar, 2014-11-26 14:00:01
imgur.com, Wed Nov 26 10:48:48 2014 UTC, Our collie pup when we first picked him up, 8, /r/aww, 4056, http://imgur.com/GPfL2iZ, 253 comments, sistercherryhair, 2014-11-26 14:00:01
sciencedaily.com, Wed Nov 26 12:36:55 2014 UTC, Scientists taking blood samples from hockey players find that when someone receives a concussion they produce a protein that remains in the blood stream for several days. Concussions that lead to lasting brain dysfunction cause SNTF to accumulate in vulnerable long axon tracts of the brain, 9, /r/science, 2886, http://www.sciencedaily.com/releases/2014/11/141125180315.htm, 108 comments, MmmmDiesel, 2014-11-26 14:00:01
i.imgur.com, Wed Nov 26 13:11:38 2014 UTC, My rise and fall in a long game of Monopoly - money charted in excel [OC], 10, /r/dataisbeautiful, 2453, http://i.imgur.com/CGFiuKl.jpg, 247 comments, FinalFinance, 2014-11-26 14:00:01
i.imgur.com, Wed Nov 26 14:10:56 2014 UTC, From my hike through the Grand Canyon earlier this Summer 2410x2410, 11, /r/EarthPorn, 1888, http://i.imgur.com/Lr46i2E.jpg, 36 comments, potato208, 2014-11-26 14:00:01
apod.nasa.gov, Wed Nov 26 12:27:11 2014 UTC, Flight deck of The Space Shuttle Endeavour, 12, /r/space, 2492, http://apod.nasa.gov/apod/image/1204/EndeavourFlightDeck_cooper_1050.jpg, 318 comments, Vmoney1337, 2014-11-26 14:00:01
en.wikipedia.org, Wed Nov 26 11:28:13 2014 UTC, TIL that during the 1977 New York blackout a number of looters stole DJ equipment from electronics stores and as a result the hip hop genre barely known outside of the Bronx at the time grew at an astounding rate from 1977 onward., 13, /r/todayilearned, 2974, http://en.wikipedia.org/wiki/Crime_in_New_York_City, 307 comments, theytakemydragons, 2014-11-26 14:00:01
self.explainlikeimfive, Wed Nov 26 12:54:50 2014 UTC, ELI5: Where does white zit pus eventually go if you don't pop the zit?, 14, /r/explainlikeimfive, 1798, /r/explainlikeimfive/comments/2nh2my/eli5_where_does_white_zit_pus_eventually_go_if/, 513 comments, j4n3st, 2014-11-26 14:00:01
self.Music, Wed Nov 26 13:32:03 2014 UTC, RAMMSTEIN ON SPOTIFY!, 15, /r/Music, 1476, /r/Music/comments/2nh5cf/rammstein_on_spotify/, 402 comments, SgtDudi, 2014-11-26 14:00:01
self.Showerthoughts, Wed Nov 26 14:55:50 2014 UTC, If you have 1 threesome your average partner per session will always be more than 1., 16, /r/Showerthoughts, 1140, /r/Showerthoughts/comments/2nhcmk/if_you_have_1_threesome_your_average_partner_per/, 133 comments, PapaFunker, 2014-11-26 14:00:01
america.aljazeera.com, Wed Nov 26 13:04:05 2014 UTC, Walmart workers plan Black Friday strike | Al Jazeera America, 17, /r/news, 1346, http://america.aljazeera.com/articles/2014/11/25/walmart-workers-planblackfridaystrike.html, 323 comments, smacksaw, 2014-11-26 14:00:01
self.IAmA, Wed Nov 26 09:08:29 2014 UTC, I'm a Greens Senator for Western Australia. Ask Me Anything, 18, /r/IAmA, 2703, /r/IAmA/comments/2ngpk0/im_a_greens_senator_for_western_australia_ask_me/, 1324 comments, scott_ludlam, 2014-11-26 14:00:01
i.imgur.com, Wed Nov 26 09:48:43 2014 UTC, Home made cured meat. The main ingredient is topside beef and natural sea salt for the process. Use of spices and berries can vary to adjust the taste. (Some sugar is used for the curing process.), 19, /r/food, 2180, http://i.imgur.com/bA5iRAH.jpg, 274 comments, GallowBoob, 2014-11-26 14:00:01
self.AskReddit, Wed Nov 26 14:25:26 2014 UTC, Girls of Reddit what are signs that you give off to let a guy know that you're interested?, 20, /r/AskReddit, 940, /r/AskReddit/comments/2nh9pt/girls_of_reddit_what_are_signs_that_you_give_off/, 4555 comments, TheBlasianSensation, 2014-11-26 14:00:01
theweek.co.uk, Wed Nov 26 10:03:06 2014 UTC, Denmark to vote on male circumcision ban, 21, /r/worldnews, 1468, http://www.theweek.co.uk/health-science/61487/denmark-to-vote-on-male-circumcision-ban, 4536 comments, hrf21, 2014-11-26 14:00:01
forbes.com, Wed Nov 26 13:38:39 2014 UTC, Long-Term Space Flights Here We Come! ISS Astronauts 3D Print The First Spare Part In Space., 22, /r/Futurology, 693, http://www.forbes.com/sites/bridaineparnell/2014/11/26/long-term-space-flights-here-we-come-iss-astronauts-3d-print-the-first-spare-part-in-space/, 95 comments, Majoby, 2014-11-26 14:00:01
i.imgur.com, Wed Nov 26 08:17:33 2014 UTC, PsBattle: Kid doing a majestic header., 23, /r/photoshopbattles, 1587, http://i.imgur.com/M6RJsiU.png, 103 comments, nosleeptill94, 2014-11-26 14:00:01
mysliderule.com, Wed Nov 26 13:01:08 2014 UTC, Over 20 Free History Courses you can take Online - from Princeton MIT Duke and others, 24, /r/history, 657, https://www.mysliderule.com/blog/world-history-best-online-courses/, 38 comments, crammberry, 2014-11-26 14:00:01
f9mag.com, Wed Nov 26 13:54:01 2014 UTC, This Man Creates Amazing Snow Art Just by Walking  Definitely A Walk to Remember Simon Beck, 25, /r/Art, 554, http://www.f9mag.com/man-creates-amazing-snow-art-just-walking-definitely-walk-remember/, 63 comments, detrimentalisttt, 2014-11-26 14:00:01
nbcnews.com, Wed Nov 26 15:10:58 2014 UTC, Ferguson Library Stays Open Amid Violence, 26, /r/UpliftingNews, 352, http://www.nbcnews.com/storyline/michael-brown-shooting/together-ferguson-library-stays-open-amid-violence-n256346, 68 comments, winged0ne, 2014-11-26 14:00:01
self.tifu, Wed Nov 26 11:37:18 2014 UTC, TIFU by reading about the guy who tifu in his business meeting, 27, /r/tifu, 626, /r/tifu/comments/2ngxy4/tifu_by_reading_about_the_guy_who_tifu_in_his/, 170 comments, LurkinInDaTifu, 2014-11-26 14:00:01
i.imgur.com, Wed Nov 26 07:21:12 2014 UTC, [Image] No Regrets, 28, /r/GetMotivated, 1342, http://i.imgur.com/xwVuvHD.png, 37 comments, EWBAITE, 2014-11-26 14:00:01
youtube.com, Wed Nov 26 04:40:50 2014 UTC, HBO's Powerpuff GIRLS, 29, /r/television, 1994, https://www.youtube.com/watch?v=dAbq2jgw6y8, 290 comments, HalpTheFan, 2014-11-26 14:00:01
imgur.com, Wed Nov 26 03:29:46 2014 UTC, My Grandparents in the 40s, 30, /r/OldSchoolCool, 2473, http://imgur.com/2ge5KCo, 111 comments, eggleg, 2014-11-26 14:00:01
self.WritingPrompts, Wed Nov 26 13:30:47 2014 UTC, [WP] Write about a totally normal day in 2014 written as a 1950's sci-fi story about living in the 21st century., 31, /r/WritingPrompts, 331, /r/WritingPrompts/comments/2nh598/wp_write_about_a_totally_normal_day_in_2014/, 59 comments, rocketjon, 2014-11-26 14:00:01
cnn.com, Wed Nov 26 02:23:22 2014 UTC, HBO to make film of Scientology book hires 160 lawyers, 32, /r/nottheonion, 2389, http://www.cnn.com/2014/11/25/showbiz/movies/going-clear-hbo-movie-lawyers/index.html?hpt=hp_t3, 264 comments, TheWinStore, 2014-11-26 14:00:01
imgur.com, Wed Nov 26 14:50:15 2014 UTC, Jurassic World could have been worse. The original idea was to have human-dinosaur hybrids. Here are some concept images leaked a few years ago, 33, /r/creepy, 237, http://imgur.com/a/ou5o6, 72 comments, Bontje, 2014-11-26 14:00:01
self.TwoXChromosomes, Wed Nov 26 13:24:55 2014 UTC, Can I just brag on my daughter a bit?, 34, /r/TwoXChromosomes, 304, /r/TwoXChromosomes/comments/2nh4rg/can_i_just_brag_on_my_daughter_a_bit/, 79 comments, timeonmyhand, 2014-11-26 14:00:01
self.LifeProTips, Wed Nov 26 14:05:59 2014 UTC, LPT: Celery that stays crunchy, 35, /r/LifeProTips, 245, /r/LifeProTips/comments/2nh814/lpt_celery_that_stays_crunchy/, 71 comments, Zoono, 2014-11-26 14:00:01
self.books, Wed Nov 26 01:51:14 2014 UTC, The Ferguson Public Library could use our support., 36, /r/books, 2146, /r/books/comments/2nfocf/the_ferguson_public_library_could_use_our_support/, 309 comments, AdamBertocci-Writer, 2014-11-26 14:00:01
reality-info.com, Wed Nov 26 15:53:51 2014 UTC, Smart earplugs sound an alarm directly into your ears to avoid waking up your partner, 37, /r/gadgets, 160, http://www.reality-info.com/2014/11/smart-earplugs-sound-alarm-directly.html, 54 comments, goki12, 2014-11-26 14:00:01
self.askscience, Wed Nov 26 15:02:11 2014 UTC, Ask Anything Wednesday - Engineering Mathematics Computer Science, 38, /r/askscience, 175, /r/askscience/comments/2nhdae/ask_anything_wednesday_engineering_mathematics/, 88 comments, AutoModerator, 2014-11-26 14:00:01
self.personalfinance, Wed Nov 26 13:49:47 2014 UTC, People who took a second job to pay off debt: what was it and what was the difference in pay between main job and second job?, 39, /r/personalfinance, 173, /r/personalfinance/comments/2nh6p1/people_who_took_a_second_job_to_pay_off_debt_what/, 339 comments, hggkhjgkhjg, 2014-11-26 14:00:01
nj.com, Tue Nov 25 21:38:42 2014 UTC, How everyone thought I missed the photo of Odell Beckham Jr.'s amazing touchdown catch ... but I didn't, 40, /r/sports, 2983, http://www.nj.com/giants/index.ssf/2014/11/how_i_got_the_best_photo_of_odell_beckham_jrs_amazing_touchdown_catch.html, 447 comments, Alphadog33, 2014-11-26 14:00:01
imgur.com, Tue Nov 25 22:22:40 2014 UTC, Bunk Bed Castle, 41, /r/DIY, 2535, http://imgur.com/a/gzJA7, 169 comments, G00D_GUY, 2014-11-26 14:00:01
self.Fitness, Wed Nov 26 17:15:29 2014 UTC, The Ultimate Recovery Day, 42, /r/Fitness, , /r/Fitness/comments/2nhr94/the_ultimate_recovery_day/, 27 comments, MrTallGuy, 2014-11-26 14:00:01
visamapper.com, Wed Nov 26 05:17:26 2014 UTC, VisaMapper  is an interactive map which tells you if you need a visa to visit a certain country and if so when and how you need to apply for it. Simply choose your nationality from the drop-down list provided and the map will change color accordingly., 43, /r/InternetIsBeautiful, 669, http://www.visamapper.com/, 36 comments, xperia3310, 2014-11-26 14:00:01
self.nosleep, Wed Nov 26 07:29:18 2014 UTC, A Letter From Alaska: Part 5, 44, /r/nosleep, 213, /r/nosleep/comments/2ngjjg/a_letter_from_alaska_part_5/, 38 comments, toss957, 2014-11-26 14:00:01
youtube.com, Wed Nov 26 17:43:27 2014 UTC, The Japanese Schindler Who Saved Thousands in WW2 (2014), 45, /r/Documentaries, , http://www.youtube.com/watch?v=DXEdxIEP6d0, comment, zxxx, 2014-11-26 14:00:01
self.listentothis, Tue Nov 25 21:45:48 2014 UTC, [Discussion] How I find new music 2.0, 46, /r/listentothis, 982, /r/listentothis/comments/2nex9a/discussion_how_i_find_new_music_20/, 215 comments, INeedAnswers123, 2014-11-26 14:00:01
i.imgur.com, Wed Nov 26 15:15:09 2014 UTC, May be speeding for soldiers homecoming, 47, /r/pics, 2696, http://i.imgur.com/W3C3zUJ.jpg, 261 comments, Dontbjelly, 2014-11-26 14:00:01
i.imgur.com, Wed Nov 26 13:00:41 2014 UTC, Oh good I'll just park illegally then., 48, /r/pics, 3567, http://i.imgur.com/uz0M6wG.jpg, 65 comments, aimzies, 2014-11-26 14:00:01
self.AskReddit, Wed Nov 26 09:11:45 2014 UTC, What free stuff on the internet should everyone be taking advantage of?, 49, /r/AskReddit, 2110, /r/AskReddit/comments/2ngpqo/what_free_stuff_on_the_internet_should_everyone/, 459 comments, PalkiaLP, 2014-11-26 14:00:01
news.net, Wed Nov 26 09:09:42 2014 UTC, Four polio vaccinators shot dead in Pakistan, 50, /r/worldnews, 1477, http://www.news.net/article/2347213/four-polio-vaccinators-shot-dead-in-sw-pakistan, 351 comments, hrf21, 2014-11-26 14:00:01
channel4.com, Tue Nov 25 22:23:53 2014 UTC, The Paedophile Hunter (2014) A vigilante along with his team poses as a young girl and arranges meetings with alleged paedophiles filming everything and passing footage to the police., 51, /r/Documentaries, 916, http://www.channel4.com/programmes/the-paedophile-hunter, 674 comments, DanielGribben, 2014-11-26 14:00:01
self.personalfinance, Wed Nov 26 15:37:55 2014 UTC, PSA: Bank of America raising fees on checking accounts, 52, /r/personalfinance, 104, /r/personalfinance/comments/2nhgz0/psa_bank_of_america_raising_fees_on_checking/, 58 comments, Notmyrealname, 2014-11-26 14:00:01
theguardian.com, Wed Nov 26 12:50:38 2014 UTC, Israeli president opposes proposed law to give national rights to Jews only, 53, /r/worldnews, 718, http://www.theguardian.com/world/2014/nov/26/israeli-president-opposes-proposed-law-of-jewish-rights, 286 comments, db82, 2014-11-26 14:00:01
consults.blogs.nytimes.com, Wed Nov 26 13:59:07 2014 UTC, TIL cold sores can be spread to the genitals causing genital herpes and up to 50% of new genital herpes cases are caused by oral sex from a partner that has cold sores., 54, /r/todayilearned, 1542, http://consults.blogs.nytimes.com/2010/05/28/can-oral-sex-spread-herpes/, 193 comments, greengrasser11, 2014-11-26 14:00:01
self.AskReddit, Wed Nov 26 13:30:43 2014 UTC, How far have you gotten before realizing Wait... I don't have work/school today?, 55, /r/AskReddit, 898, /r/AskReddit/comments/2nh58x/how_far_have_you_gotten_before_realizing_wait_i/, 905 comments, Mijder, 2014-11-26 14:00:01
rte.ie, Wed Nov 26 10:48:03 2014 UTC, India to raise smoking age to 25, 56, /r/worldnews, 1024, http://www.rte.ie/news/2014/1126/662616-india-smoking/, 204 comments, webby_mc_webberson, 2014-11-26 14:00:01
i.imgur.com, Wed Nov 26 11:32:20 2014 UTC, Well shit. (xpost r/straya), 57, /r/pics, 4241, http://i.imgur.com/16qgO45.jpg, 1186 comments, Lugozi, 2014-11-26 14:00:01
npr.org, Wed Nov 26 08:18:33 2014 UTC, TIL Ferrero uses a quarter of the worlds hazelnuts making Nutella., 58, /r/todayilearned, 4112, http://www.npr.org/blogs/thesalt/2014/09/16/347749070/thanks-to-nutella-the-world-needs-more-hazelnuts, 822 comments, ThouShaltNotFart, 2014-11-26 14:00:01
nypost.com, Wed Nov 26 14:39:13 2014 UTC, Student took this photo of a bear just before it killed him, 59, /r/news, 766, http://nypost.com/2014/11/25/hiker-took-cell-phone-pictures-of-bear-before-deadly-attack/, 511 comments, journalist31000, 2014-11-26 14:00:01
taimur.org, Tue Nov 25 19:39:09 2014 UTC, The History of Western Philosophy in one picture, 60, /r/philosophy, 397, http://taimur.org/2014/10/22/the-history-of-western-philosophy/, 97 comments, Qwill2, 2014-11-26 14:00:01
self.IAmA, Wed Nov 26 15:41:26 2014 UTC, We are comet scientists and engineers working on Philae and Rosetta. We just triple-landed a robot lab on a comet. Ask us Anything!, 61, /r/IAmA, 617, /r/IAmA/comments/2nhhd8/we_are_comet_scientists_and_engineers_working_on/, 315 comments, RosettaAMA, 2014-11-26 14:00:01
i.imgur.com, Wed Nov 26 10:35:46 2014 UTC, The worst moment of Minesweeper..., 62, /r/gaming, 3381, http://i.imgur.com/Nh9b7mv.jpg, 734 comments, fadetoblack1004, 2014-11-26 14:00:01
self.askscience, Wed Nov 26 03:47:50 2014 UTC, Does an increase in population increase or decrease the rate of evolution?, 63, /r/askscience, 944, /r/askscience/comments/2ng07d/does_an_increase_in_population_increase_or/, 159 comments, sneakyimp, 2014-11-26 14:00:01
youtube.com, Wed Nov 26 16:38:09 2014 UTC, Cold War (1998), 64, /r/Documentaries, 25, https://www.youtube.com/watch?v=ZZx3IAj9f0k&index=1&list=PL4rXQPgripyY1DPlpZSfY-MHhQwcBEEOQ, 3 comments, ergasia, 2014-11-26 14:00:01
news.nationalpost.com, Wed Nov 26 14:34:52 2014 UTC, Putin released a Siberian tiger into the wild  now its tormenting Chinese farmers, 65, /r/news, 659, http://news.nationalpost.com/2014/11/26/putin-released-a-siberian-tiger-into-the-wild-now-its-tormenting-chinese-farmers/, 60 comments, 604nation, 2014-11-26 14:00:01
i.imgur.com, Wed Nov 26 14:02:25 2014 UTC, How do I upvote someone in public, 66, /r/funny, 2730, http://i.imgur.com/oZY26b3.jpg, 76 comments, just05, 2014-11-26 14:00:01
i.imgur.com, Wed Nov 26 12:53:20 2014 UTC, Just chilling dog, 67, /r/funny, 3243, http://i.imgur.com/Qv81gPN.jpg, 60 comments, sheldonpooper, 2014-11-26 14:00:01
i.imgur.com, Wed Nov 26 11:34:46 2014 UTC, I found a vegan slaughterhouse, 68, /r/funny, 4187, http://i.imgur.com/1CA1S7n.jpg, 212 comments, winter_storm, 2014-11-26 14:00:01
imgur.com, Wed Nov 26 12:46:47 2014 UTC, Thanks to a drunk driver I said goodbye to a best friend and bandmate yesterday (He's in the blue hoodie). Please don't drink and drive., 69, /r/pics, 2519, http://imgur.com/iOcyFsN, 830 comments, j0shd0gge, 2014-11-26 14:00:01
i.imgur.com, Wed Nov 26 13:23:06 2014 UTC, Dear Women Please start practicing pole dancing outdoors. Thanks Tommy., 70, /r/pics, 2198, http://i.imgur.com/SQc9UvG.jpg, 270 comments, KellyKingJ, 2014-11-26 14:00:01
self.tifu, Wed Nov 26 00:28:39 2014 UTC, TIFU by being too impressed with a YouTube video (photo of aftermath included), 71, /r/tifu, 2816, /r/tifu/comments/2nffre/tifu_by_being_too_impressed_with_a_youtube_video/, 586 comments, dafunkmasta, 2014-11-26 14:00:01
imgur.com, Wed Nov 26 10:23:19 2014 UTC, As a Brit this is how I imagine black Friday in America., 72, /r/funny, 4772, http://imgur.com/gO5Sx6m, 2180 comments, _theseacucumber, 2014-11-26 14:00:01
qi.com, Wed Nov 26 10:22:58 2014 UTC, TIL Until the late 1400s the word 'girl' just meant a child of either sex. If you had to differentiate between them male children were referred to as 'knave girls' and females were 'gay girls'. Equally a boy could be called a 'knave child' and a girl a 'maiden child'., 73, /r/todayilearned, 2031, http://qi.com/infocloud/gender, 136 comments, markhunt1980, 2014-11-26 14:00:01
huffingtonpost.com, Wed Nov 26 14:22:31 2014 UTC, TIL a man unearthed a hoard of Roman gold coins worth $156000 within 20 minutes of his first time using a metal detector., 74, /r/todayilearned, 959, http://www.huffingtonpost.com/2013/06/07/wesley-carrington-finds-roman-gold-coins_n_3404112.html, 37 comments, mike_pants, 2014-11-26 14:00:01
self.nosleep, Wed Nov 26 00:16:48 2014 UTC, Don't answer ads posted at 2 AM in the morning, 75, /r/nosleep, 439, /r/nosleep/comments/2nfej5/dont_answer_ads_posted_at_2_am_in_the_morning/, 139 comments, Bryce333, 2014-11-26 14:00:01
i.imgur.com, Wed Nov 26 16:12:41 2014 UTC, This glass floor is being held up by thousands of plastic toy figures, 76, /r/pics, 1165, http://i.imgur.com/qvbgMPV.jpg, 63 comments, JiveMonkey, 2014-11-26 14:00:01
i.imgur.com, Wed Nov 26 15:36:58 2014 UTC, My parents just celebrated their anniversary. This is what love looks like 54 years later, 77, /r/aww, 920, http://i.imgur.com/gaA4ZJ6.jpg, 18 comments, R3dLady, 2014-11-26 14:00:01
smithsonianmag.com, Wed Nov 26 13:18:50 2014 UTC, TIL Rudolph the Red Nosed Reindeer originally named Reginald began 75 years ago as a promotional coloring book gimmick during the Great Depression. Over the years Rudolph had a son named Robbie a brother named Rusty and another cranky and overweight brother called Ralph., 78, /r/todayilearned, 1136, http://www.smithsonianmag.com/arts-culture/it-could-have-been-reginald-red-nosed-reindeer-180953390/?no-ist, 29 comments, not_charles_grodin, 2014-11-26 14:00:01
buffalonews.com, Wed Nov 26 16:46:08 2014 UTC, Buffalo police officer charged with stealing $130 from womans purse - after a Good Samaritan discovered purse and turned it over to a police officer asked the officer to find the owner and return the property., 79, /r/news, 369, http://www.buffalonews.com/city-region/police-blotter/buffalo-police-officer-charged-with-stealing-130-from-womans-purse-20141023, 46 comments, maxwellhill, 2014-11-26 14:00:01
i.imgur.com, Wed Nov 26 11:53:53 2014 UTC, Vandalism? ... No problem we fix this!, 80, /r/gifs, 2878, http://i.imgur.com/2ExNlKf.gif, 171 comments, PixelPunkt, 2014-11-26 14:00:01
imgur.com, Wed Nov 26 12:07:56 2014 UTC, The Babadook, 81, /r/creepy, 198, https://imgur.com/aYYz9UT, 51 comments, pythONLINE, 2014-11-26 14:00:01
iraqinews.com, Wed Nov 26 15:23:18 2014 UTC, Iraqi warplanes kill ISIS commander of Heet and 22 of his aides, 82, /r/worldnews, 286, http://www.iraqinews.com/iraq-war/iraqi-warplanes-kill-isis-commander-heet-22-aides/, 40 comments, luciussullafelix, 2014-11-26 14:00:01
i.imgur.com, Wed Nov 26 11:45:00 2014 UTC, A Bulbasaur I found in my backyard., 83, /r/pics, 2510, http://i.imgur.com/L53VW77.jpg, 92 comments, just05, 2014-11-26 14:00:01
americanradiohistory.com, Tue Nov 25 21:04:38 2014 UTC, Every issue from 1954 to 1982 of Popular Electronics Magazine, 84, /r/InternetIsBeautiful, 1530, http://www.americanradiohistory.com/Popular-Electronics-Guide.htm, 82 comments, davey_b, 2014-11-26 14:00:01
i.imgur.com, Wed Nov 26 15:08:26 2014 UTC, African American fraternity cleaning up after the Ferguson protests. What the media doesn't show, 85, /r/pics, 2095, http://i.imgur.com/0AQl7KW.jpg, 450 comments, goalie_monkey, 2014-11-26 14:00:01
i.imgur.com, Wed Nov 26 14:45:46 2014 UTC, I am thy father., 86, /r/funny, 1774, http://i.imgur.com/WC0MzBq.jpg, 36 comments, IDrewtheworld, 2014-11-26 14:00:01
self.science, Wed Nov 26 12:39:59 2014 UTC, Science AMA Series: We are Alan Sanders Michael Bailey and Gary Beecham co-authors of a recently published study on the genetics of male sexual orientation Ask Us Anything!, 87, /r/science, 1372, /r/science/comments/2nh1nb/science_ama_series_we_are_alan_sanders_michael/, 334 comments, Dr_Alan_Sanders, 2014-11-26 14:00:01
laist.com, Wed Nov 26 02:20:48 2014 UTC, HBO hires 160 lawyers in preparation for Scientology documentary release., 88, /r/news, 4507, http://laist.com/2014/11/24/hbos_working_on_an_in-depth_doc.php, 1562 comments, HotGravy, 2014-11-26 14:00:01
i.imgur.com, Wed Nov 26 13:58:22 2014 UTC, The safest place in Ferguson..., 89, /r/funny, 2123, http://i.imgur.com/kL4avVF.jpg, 507 comments, thejshep, 2014-11-26 14:00:01
self.askscience, Wed Nov 26 03:47:41 2014 UTC, Why does my hot drink have steam rising from it when it is below its boiling point?, 90, /r/askscience, 630, /r/askscience/comments/2ng06u/why_does_my_hot_drink_have_steam_rising_from_it/, 140 comments, 1919, 2014-11-26 14:00:01
self.Jokes, Wed Nov 26 13:25:29 2014 UTC, Three bulls, 91, /r/Jokes, 477, /r/Jokes/comments/2nh4ss/three_bulls/, 25 comments, Gin_chan, 2014-11-26 14:00:01
i.imgur.com, Wed Nov 26 14:48:30 2014 UTC, Black Friday Shoppers, 92, /r/funny, 1695, http://i.imgur.com/88uVVlK.jpg, 65 comments, hooraah, 2014-11-26 14:00:01
self.DIY, Wed Nov 26 10:05:17 2014 UTC, I just made a new subreddit intended for use by the DIY community called /r/WhatShouldIDoWithIt. :), 93, /r/DIY, 136, /r/DIY/comments/2ngsr9/i_just_made_a_new_subreddit_intended_for_use_by/, 12 comments, Rooivalk1, 2014-11-26 14:00:01
lh3.googleusercontent.com, Wed Nov 26 13:05:00 2014 UTC, Yes they love to be pampered too!, 94, /r/gifs, 2003, https://lh3.googleusercontent.com/-2Ji4LZHDWx8/VHNGFcMBiHI/AAAAAAAAMqk/iDCBQymMbBs/w500-h281-no/Ninita.gif, 63 comments, hash1e, 2014-11-26 14:00:01
partiallyexaminedlife.com, Wed Nov 26 15:22:20 2014 UTC, Justice and the Dialectic of Anger and Guilt | The Partially Examined Life, 95, /r/philosophy, 7, http://www.partiallyexaminedlife.com/2014/11/26/justice-and-the-dialectic-of-anger-and-guilt/, comment, mjburgess, 2014-11-26 14:00:01
dohanews.co, Wed Nov 26 08:48:42 2014 UTC, Qatar arrests workers for protesting over low pay, 96, /r/worldnews, 773, http://dohanews.co/witnesses-authorities-arrest-laborers-striking-low-pay-qatar/, 73 comments, PeaceDealer, 2014-11-26 14:00:01
i.imgur.com, Wed Nov 26 01:42:43 2014 UTC, [Image] When My College Workload Gets Too Stressful, 97, /r/GetMotivated, 1605, http://i.imgur.com/GsGgm03.jpg, 275 comments, quadlord, 2014-11-26 14:00:01
i.imgur.com, Wed Nov 26 15:53:21 2014 UTC, Two Beautiful Flappers in Front of a Peerless Touring Car San Francisco Bay Area 1923., 98, /r/OldSchoolCool, 107, http://i.imgur.com/S52OsCY.jpg, 17 comments, michaelconfoy, 2014-11-26 14:00:01
self.Fitness, Wed Nov 26 14:21:23 2014 UTC, From a fat loss persepective is cardio merely a way to burn calories?, 99, /r/Fitness, 55, /r/Fitness/comments/2nh9d4/from_a_fat_loss_persepective_is_cardio_merely_a/, 61 comments, DiceRightYoYo, 2014-11-26 14:00:01
imgur.com, Tue Nov 25 19:23:29 2014 UTC, The black swallower. This is a real fish., 100, /r/creepy, 3499, http://imgur.com/a/5PECO, 577 comments, The2500, 2014-11-26 14:00:01
