domain, post_time, title, rank, subreddit, score, link, comments, submitter, timestamp
i.imgur.com, Thu Nov 27 12:50:25 2014 UTC, Happy Thanksgiving! I call this picture 'We have no idea how we actually managed to take this.', 1, /r/aww, 4559, http://i.imgur.com/uaSRuna.jpg, 222 comments, DisgruntledPlebian, 2014-11-27 12:00:01
i.imgur.com, Thu Nov 27 12:33:01 2014 UTC, Holiday decor done right, 2, /r/pics, 3811, http://i.imgur.com/8j9YYCN.jpg, 166 comments, GallowBoob, 2014-11-27 12:00:01
i.imgur.com, Thu Nov 27 11:44:07 2014 UTC, The man on this sign has a hat, 3, /r/mildlyinteresting, 3986, http://i.imgur.com/F34dl7D.jpg, 380 comments, Aifryz, 2014-11-27 12:00:01
i.imgur.com, Thu Nov 27 13:48:31 2014 UTC, NFL family Thanksgiving, 4, /r/funny, 2597, http://i.imgur.com/HDjSAvm.jpg, 130 comments, girth_king, 2014-11-27 12:00:01
lh3.googleusercontent.com, Thu Nov 27 12:15:55 2014 UTC, Don't dare mess with this cat.., 5, /r/gifs, 2759, https://lh3.googleusercontent.com/-vbW7A8jkPvo/VHbPN_wjpUI/AAAAAAAADrs/m--EIuKyj80/w324-h191-no/abd-215.gif, 419 comments, hash1e, 2014-11-27 12:00:01
sciencedaily.com, Thu Nov 27 10:05:05 2014 UTC, New study finds that DNA can survive a flight through space and re-entry into Earth's atmosphere and still pass on genetic information. These results indicate that life and organic molecules could potentially spread between planetary bodies through meteor impacts., 6, /r/science, 3855, http://www.sciencedaily.com/releases/2014/11/141126144150.htm, 354 comments, Comoquit, 2014-11-27 12:00:01
historycommons.org, Thu Nov 27 10:53:09 2014 UTC, TIL That a few days after the Oklahoma City Bombings a severed left leg was found in the rubble. DNA evidence showed that it from a victim Lakesha Levy. When they went to return her leg it was found that she was already buried with one. It is unknown who the buried leg belongs to., 7, /r/todayilearned, 3134, http://www.historycommons.org/context.jsp?item=a080795legrealbomber, 262 comments, llamanatee, 2014-11-27 12:00:01
i.imgur.com, Thu Nov 27 09:51:33 2014 UTC, Planetary Glass Set, 8, /r/space, 3263, http://i.imgur.com/q7gxQFQ.jpg, 325 comments, GallowBoob, 2014-11-27 12:00:01
en.itar-tass.com, Thu Nov 27 10:13:53 2014 UTC, WikiLeaks founder: Google works for US State Department, 9, /r/worldnews, 2851, http://en.itar-tass.com/world/763927, 617 comments, Xanadu_resident, 2014-11-27 12:00:01
i.imgur.com, Thu Nov 27 06:43:54 2014 UTC, PsBattle: mall train stolen during Ferguson riots, 10, /r/photoshopbattles, 2904, http://i.imgur.com/tV3zyGD.jpg, 278 comments, kaseyunderneath, 2014-11-27 12:00:01
insider.foxnews.com, Thu Nov 27 08:55:56 2014 UTC, Obama: Only Native Americans Can Legitimately Object to Immigration, 11, /r/nottheonion, 1852, http://insider.foxnews.com/2014/11/26/obama-only-native-americans-can-legitimately-object-immigration, 998 comments, mrojek, 2014-11-27 12:00:01
imgur.com, Thu Nov 27 10:04:39 2014 UTC, Bryce Canyon - just awesome [2816  2112] [OC], 12, /r/EarthPorn, 1461, http://imgur.com/xFWPrsx, 57 comments, stay_cranky, 2014-11-27 12:00:01
twitter.com, Thu Nov 27 04:47:08 2014 UTC, RIP Phil Hughes a cricketer who was involved in a freak accident during a cricket match., 13, /r/sports, 3637, https://twitter.com/CricketAus/status/537828117989949440, 1382 comments, ricemanh, 2014-11-27 12:00:01
youtube.com, Thu Nov 27 04:21:55 2014 UTC, World's fastest talking man sings Michael Jackson's BAD in 20 seconds, 14, /r/videos, 3746, https://www.youtube.com/watch?v=4X4Fy8YqysY, 645 comments, cubalittle, 2014-11-27 12:00:01
latimes.com, Thu Nov 27 03:30:56 2014 UTC, CDC: Fewer than 18% of American adults smoke cigarettes a new low, 15, /r/news, 4134, http://www.latimes.com/science/sciencenow/la-sci-sn-cigarette-smoking-rates-new-low-20141126-story.html, 2771 comments, BlankVerse, 2014-11-27 12:00:01
dailymail.co.uk, Thu Nov 27 03:55:43 2014 UTC, Millionaire Chinese businessman bulldozes run down huts in village where he grew up and builds luxury flats for residents instead... for free., 16, /r/UpliftingNews, 3779, http://www.dailymail.co.uk/news/article-2850436/Millionaire-Chinese-businessman-bulldozes-run-huts-village-grew-builds-luxury-flats-residents-instead-free.html, 511 comments, nicksatdown, 2014-11-27 12:00:01
self.explainlikeimfive, Thu Nov 27 06:11:43 2014 UTC, ELI5:if we eat chicken eggs and chicken in mass consumption. Why do we eat turkey but not turkey eggs?, 17, /r/explainlikeimfive, 2446, /r/explainlikeimfive/comments/2nk0g6/eli5if_we_eat_chicken_eggs_and_chicken_in_mass/, 936 comments, solemnelephant, 2014-11-27 12:00:01
self.Jokes, Thu Nov 27 12:47:08 2014 UTC, A piece of toast and a hard boiled egg walked into a bar....., 18, /r/Jokes, 715, /r/Jokes/comments/2nkp3p/a_piece_of_toast_and_a_hard_boiled_egg_walked/, 40 comments, blairibus, 2014-11-27 12:00:01
i.imgur.com, Thu Nov 27 04:26:49 2014 UTC, Mario Kart Haiku, 19, /r/gaming, 3255, http://i.imgur.com/MKgQWQz.jpg, 426 comments, refekt, 2014-11-27 12:00:01
i.imgur.com, Thu Nov 27 09:29:26 2014 UTC, My Mum yelling at a cop during an anti-apartheid protest (1981), 20, /r/OldSchoolCool, 1269, http://i.imgur.com/5SBPeCD.jpg, 727 comments, BrianScalabrine_AMA, 2014-11-27 12:00:01
self.IAmA, Thu Nov 27 13:43:02 2014 UTC, IamA: I am Eddie Chaloner I have volunteered on several missions for the HALO Trust (land mine clearance) in Afghanistan Iraq and other conflict zones I was involved in making a major war film --Kajaki-- AmA!, 21, /r/IAmA, 471, /r/IAmA/comments/2nksnh/iama_i_am_eddie_chaloner_i_have_volunteered_on/, 92 comments, echaloner, 2014-11-27 12:00:01
i.imgur.com, Thu Nov 27 01:07:16 2014 UTC, Every year for thanksgiving I make pie for all my neighbors. 8 hours and 40 pies later..., 22, /r/food, 4319, http://i.imgur.com/ILP42iw.jpg, 924 comments, boobdiggity, 2014-11-27 12:00:01
self.AskReddit, Thu Nov 27 11:57:45 2014 UTC, What are two words that when put together make you cringe?, 23, /r/AskReddit, 548, /r/AskReddit/comments/2nkmap/what_are_two_words_that_when_put_together_make/, 1712 comments, MantisTobogganMDPhD, 2014-11-27 12:00:01
imgur.com, Thu Nov 27 01:29:54 2014 UTC, Here's my painting of Billy Murray as Steve Zissou in oils it's 10x14., 24, /r/movies, 2906, http://imgur.com/TYOzNKu, 436 comments, Hara-Kiri, 2014-11-27 12:00:01
self.Showerthoughts, Thu Nov 27 01:46:37 2014 UTC, Instead of tear gas police should employ THC cannisters during a riot and push multiple free snack carts in outward directions to disperse rioters and dissuade them from destruction., 25, /r/Showerthoughts, 2728, /r/Showerthoughts/comments/2njc4d/instead_of_tear_gas_police_should_employ_thc/, 300 comments, TheFunBus, 2014-11-27 12:00:01
self.tifu, Wed Nov 26 23:29:53 2014 UTC, TIFU by dying at the doctor's office pitching a tent in front of a bunch of women and forcing a fireman to carry my erect body., 26, /r/tifu, 2948, /r/tifu/comments/2niypv/tifu_by_dying_at_the_doctors_office_pitching_a/, 690 comments, Yuzki, 2014-11-27 12:00:01
self.TwoXChromosomes, Thu Nov 27 03:36:02 2014 UTC, UPDATE: The man I'm in love with told me that if I want to be with him I have to keep it a secret because he's embarrassed of the way I look., 27, /r/TwoXChromosomes, 1294, /r/TwoXChromosomes/comments/2njmii/update_the_man_im_in_love_with_told_me_that_if_i/, 651 comments, fatuglyandalone, 2014-11-27 12:00:01
i.imgur.com, Wed Nov 26 21:21:45 2014 UTC, Kept this Isaac Asimov quote on my wall since freshman year of college. Applies to every human. [image], 28, /r/GetMotivated, 3561, http://i.imgur.com/NxStjBx.jpg, 175 comments, Resawla, 2014-11-27 12:00:01
eunter.net, Thu Nov 27 12:10:35 2014 UTC, Amy Poehlers Yes Please: S.N.L. Memories and Getting-Some-Rest Dreams, 29, /r/books, 235, http://eunter.net/2014/11/amy-poehlers-yes-please-s-n-l-memories-and-getting-some-rest-dreams/, 36 comments, Doctor_Heat, 2014-11-27 12:00:01
halcyonmaps.com, Thu Nov 27 13:23:41 2014 UTC, The size of the world's largest armies from antiquity to the present day, 30, /r/dataisbeautiful, 184, http://www.halcyonmaps.com/military-superpowers-throughout-history/, 98 comments, stefankruithof, 2014-11-27 12:00:01
i.imgur.com, Thu Nov 27 03:20:53 2014 UTC, How did you do in P.E. today?, 31, /r/creepy, 1131, http://i.imgur.com/rNZMMtW.jpg, 62 comments, EnCamp, 2014-11-27 12:00:01
youtube.com, Thu Nov 27 04:30:08 2014 UTC, I just watched Burts Buzz (2014) - A documentary about the founder of Burts Bees. He's an eccentric guy that signed away $200M+ and the majority of the company because he likes to be frugal and live simply. He lives in the backwoods of Maine being thrifty and doing whatever the fuck he wants., 32, /r/Documentaries, 716, https://www.youtube.com/watch?v=lfct3mM3I_g, 126 comments, aknalid, 2014-11-27 12:00:01
theguardian.com, Thu Nov 27 10:58:56 2014 UTC, Researchers in Germany have grown complete spinal cords in a Petri dish, 33, /r/Futurology, 218, http://www.theguardian.com/science/neurophilosophy/2014/nov/26/lab-grown-spinal-cords, 16 comments, GettaReddit, 2014-11-27 12:00:01
imgur.com, Wed Nov 26 20:00:21 2014 UTC, I'm making shelters for local neighborhood strays!, 34, /r/DIY, 3072, http://imgur.com/a/pls7Y, 767 comments, iamactuallyalion, 2014-11-27 12:00:01
self.WritingPrompts, Thu Nov 27 09:46:10 2014 UTC, [WP] You are watching a live stream from the international space station. The video feed goes out due to a temporary loss of signal. Minutes later when the live feed comes back on everyone on the space station is dead and most of the station in shambles. What happened?, 35, /r/WritingPrompts, 230, /r/WritingPrompts/comments/2nkev7/wp_you_are_watching_a_live_stream_from_the/, 38 comments, Alecamer7, 2014-11-27 12:00:01
self.LifeProTips, Wed Nov 26 18:12:41 2014 UTC, LPT: When copying text use Control+Shift+V to paste without formatting, 36, /r/LifeProTips, 3983, /r/LifeProTips/comments/2nhxxv/lpt_when_copying_text_use_controlshiftv_to_paste/, 690 comments, eduardobeattie, 2014-11-27 12:00:01
forrent.com, Thu Nov 27 15:09:26 2014 UTC, Creative interactive site that tells you the optimal distance you should be sitting from your television based on its size and resolution (Should be useful for Black Friday / Christmas)., 37, /r/InternetIsBeautiful, , http://www.forrent.com/blog/tv-size/, 20 comments, Mary8666, 2014-11-27 12:00:01
fc06.deviantart.net, Thu Nov 27 02:23:33 2014 UTC, Sci-fi City by JadrienC, 38, /r/Art, 815, http://fc06.deviantart.net/fs71/f/2013/061/6/4/alongthepenobscot_jadriencousens_by_jadrienc-d5wr0ua.png, 56 comments, KeanusDracula, 2014-11-27 12:00:01
consequenceofsound.net, Wed Nov 26 19:42:35 2014 UTC, Creed singer Scott Stapp says he's broke and living in a Holiday Inn., 39, /r/Music, 2712, http://consequenceofsound.net/2014/11/scott-stapp-says-hes-broke-living-in-a-holiday-inn-and-under-attack/, 1782 comments, doogie92, 2014-11-27 12:00:01
dashboardcitizen.com, Thu Nov 27 11:08:08 2014 UTC, 13 of Some of the Best Written TV Shows in History, 40, /r/television, 142, http://dashboardcitizen.com/best-written-tv-shows-in-history/, 173 comments, mike3303, 2014-11-27 12:00:01
navdy.com, Thu Nov 27 08:07:18 2014 UTC, Car navigator HUD projector with gestures and wifi connection with complete support for android and iOS., 41, /r/gadgets, 242, https://www.navdy.com/?utm_source=AdWords&utm_medium=CPC, 82 comments, loz3vi, 2014-11-27 12:00:01
self.Fitness, Wed Nov 26 21:46:20 2014 UTC, New Bro Science Video: All Protein Thanksgiving, 42, /r/Fitness, 1364, /r/Fitness/comments/2nin42/new_bro_science_video_all_protein_thanksgiving/, 174 comments, IEvolvedFromAMonkey, 2014-11-27 12:00:01
self.personalfinance, Thu Nov 27 11:41:34 2014 UTC, Father died receiving SS do I have to pay his tax bill?, 43, /r/personalfinance, 101, /r/personalfinance/comments/2nklez/father_died_receiving_ss_do_i_have_to_pay_his_tax/, 33 comments, arlet_o3, 2014-11-27 12:00:01
self.askscience, Wed Nov 26 17:45:41 2014 UTC, What happens to water that is put into freezing temperature but unable to expand into ice due to space constrains?, 44, /r/askscience, 2577, /r/askscience/comments/2nhuig/what_happens_to_water_that_is_put_into_freezing/, 710 comments, durrymaster, 2014-11-27 12:00:01
self.history, Thu Nov 27 10:59:21 2014 UTC, Is Moses a hebrew name or is it an Egyptian name?, 45, /r/history, 77, /r/history/comments/2nkj3d/is_moses_a_hebrew_name_or_is_it_an_egyptian_name/, 33 comments, LamborghiniVeneno, 2014-11-27 12:00:01
self.nosleep, Wed Nov 26 23:35:57 2014 UTC, My friend Lily disappeared ten years ago. Everybody says she never existed., 46, /r/nosleep, 560, /r/nosleep/comments/2nizdh/my_friend_lily_disappeared_ten_years_ago/, 88 comments, missinglily, 2014-11-27 12:00:01
youtube.com, Thu Nov 27 13:58:45 2014 UTC, Electric Guest -- Ritual Union [Alternative/Chill/Electronic] (2014), 47, /r/listentothis, 35, https://www.youtube.com/watch?v=RkOcxEfHE2Y, 3 comments, taainthemorning, 2014-11-27 12:00:01
independent.co.uk, Wed Nov 26 19:01:15 2014 UTC, Albert Camus and Jean-Paul Sartre: 'Lost' letter shows philosophers were dearest friends before their bitter falling-out, 48, /r/philosophy, 438, http://www.independent.co.uk/news/people/albert-camus-and-jeanpaul-sartre-lost-letter-shows-philosophers-were-dearest-friends-before-their-bitter-fallingout-9885558.html, 52 comments, JuanGoodman, 2014-11-27 12:00:01
i.imgur.com, Thu Nov 27 15:48:54 2014 UTC, I'm not sad I'm working Thanksgiving I'm sad my donut shop is closed., 49, /r/pics, , http://i.imgur.com/fDcPpRL.jpg, 161 comments, jkorpela, 2014-11-27 12:00:01
self.LifeProTips, Thu Nov 27 13:32:52 2014 UTC, LPT:If you have pets or something furry in your household fold your clothes inside out to prevent the hairs clinging to the visible side., 50, /r/LifeProTips, 105, /r/LifeProTips/comments/2nkrz1/lptif_you_have_pets_or_something_furry_in_your/, 18 comments, british_grapher, 2014-11-27 12:00:01
i.imgur.com, Thu Nov 27 12:01:58 2014 UTC, Selfie with a bad eagle, 51, /r/funny, 3384, http://i.imgur.com/Y1g6oMn.png?1, 329 comments, elena_123, 2014-11-27 12:00:01
theguardian.com, Thu Nov 27 10:28:41 2014 UTC, Records broken as vinyl sales reach 1m in 2014  the highest in two decades  driven by Pink Floyd & Arctic Monkeys, 52, /r/Music, 164, http://www.theguardian.com/music/2014/nov/27/vinyl-sales-1m-2014-pink-floyd-artic-monkeys-jack-white, 27 comments, starrydive, 2014-11-27 12:00:01
youtube.com, Thu Nov 27 10:53:44 2014 UTC, A Bad Lip Reading of Catching Fire, 53, /r/videos, 1010, http://www.youtube.com/watch?v=RKOZgQy8qrw, 83 comments, sinebiryan, 2014-11-27 12:00:01
self.askscience, Thu Nov 27 12:37:37 2014 UTC, Light is generally described as having a sinusoidal waveform. Is it possible to have light as other waveforms such as a square wave saw-tooth wave or triangle wave? If so how differently would such light behave in relation to classic sinusoidal light?, 54, /r/askscience, 75, /r/askscience/comments/2nkoih/light_is_generally_described_as_having_a/, 14 comments, platinum95, 2014-11-27 12:00:01
self.Showerthoughts, Thu Nov 27 12:57:08 2014 UTC, Ever notice that strap on spelled backwards reads no parts?, 55, /r/Showerthoughts, 308, /r/Showerthoughts/comments/2nkpqv/ever_notice_that_strap_on_spelled_backwards_reads/, 20 comments, rotll, 2014-11-27 12:00:01
livescience.com, Thu Nov 27 14:41:45 2014 UTC, Mystery of 'Vampire' Burials Solved, 56, /r/history, 36, http://www.livescience.com/48924-mystery-of-vampire-burials-solved.html, 2 comments, marquis_of_chaos, 2014-11-27 12:00:01
amren.com, Thu Nov 27 13:53:55 2014 UTC, TIL when prison rape is counted more men are raped in the US every year than women, 57, /r/todayilearned, 1799, http://www.amren.com/news/2013/10/more-men-are-raped-in-the-us-than-women-figures-on-prison-assaults-reveal/, 1522 comments, Playaguy, 2014-11-27 12:00:01
i.imgur.com, Thu Nov 27 14:22:43 2014 UTC, PEGASUS Airborne Forces Memorial by Charlie Langton - 2012, 58, /r/Art, 72, http://i.imgur.com/rVjiYyW.jpg, 6 comments, Nadiime, 2014-11-27 12:00:01
self.WritingPrompts, Thu Nov 27 12:44:15 2014 UTC, [WP] Describe a typical day in the White House. As seen through the greatest fears of a conspiracy theorist., 59, /r/WritingPrompts, 110, /r/WritingPrompts/comments/2nkoww/wp_describe_a_typical_day_in_the_white_house_as/, 16 comments, Worstdriver, 2014-11-27 12:00:01
self.AskReddit, Thu Nov 27 12:21:20 2014 UTC, If we as girlfriends/wives/fiances get bought flowers and chocolates 'just because' - what are the best 'just because' gifts for our boyfriends/husbands/fiances?, 60, /r/AskReddit, 403, /r/AskReddit/comments/2nknkh/if_we_as_girlfriendswivesfiances_get_bought/, 631 comments, snowycrackle, 2014-11-27 12:00:01
self.AskReddit, Thu Nov 27 13:11:53 2014 UTC, What's a common misconception about your country?, 61, /r/AskReddit, 336, /r/AskReddit/comments/2nkqo3/whats_a_common_misconception_about_your_country/, 1247 comments, monstersnshit, 2014-11-27 12:00:01
bloomberg.com, Thu Nov 27 12:02:27 2014 UTC, Molten Aluminum Lakes Offer Power Storage for German Wind Farms, 62, /r/Futurology, 132, http://www.bloomberg.com/news/2014-11-27/molten-aluminum-lakes-offer-power-storage-for-german-wind-farms.html, 31 comments, ju6ju8Oo, 2014-11-27 12:00:01
vine.co, Thu Nov 27 02:14:37 2014 UTC, One Direction star taking selfies with fans and hating life, 63, /r/videos, 4003, https://vine.co/v/O1PB7A3unUv, 1887 comments, orangemonkeyeagle1, 2014-11-27 12:00:01
youtube.com, Thu Nov 27 13:44:52 2014 UTC, Radio Moscow -- These Days [Blues Rock] (2014), 64, /r/listentothis, 27, https://www.youtube.com/watch?v=h1JlBhhpDms, 3 comments, Dei-Ex-Machina, 2014-11-27 12:00:01
i.imgur.com, Thu Nov 27 12:18:21 2014 UTC, Meanwhile in China..., 65, /r/funny, 2231, http://i.imgur.com/9XV84ws.jpg, 54 comments, jrinredcar, 2014-11-27 12:00:01
self.askscience, Thu Nov 27 07:11:05 2014 UTC, Do Sociopaths Have Empathetic Yawns?, 66, /r/askscience, 146, /r/askscience/comments/2nk517/do_sociopaths_have_empathetic_yawns/, 18 comments, R99Kie, 2014-11-27 12:00:01
self.AskReddit, Thu Nov 27 00:29:37 2014 UTC, Excluding God vs Devil what two characters are the best representation of Good vs Evil?, 67, /r/AskReddit, 3016, /r/AskReddit/comments/2nj4uw/excluding_god_vs_devil_what_two_characters_are/, 8877 comments, supergordo, 2014-11-27 12:00:01
i.imgur.com, Thu Nov 27 14:52:35 2014 UTC, Ha ha I'm dead inside, 68, /r/gifs, 1126, http://i.imgur.com/7K3ei0S.gif, 116 comments, Farisr9k, 2014-11-27 12:00:01
cnn.com, Thu Nov 27 12:30:11 2014 UTC, TIL that in January 1997 the capitol of Ghana rioted over accusations of penis snatching wizards. Several people were killed by mobs who accused them of using magic handshakes to kidnap penises and hold them for ransom., 69, /r/todayilearned, 1524, http://www.cnn.com/WORLD/9701/18/briefs/ghana.penis.html, 125 comments, MmmmDiesel, 2014-11-27 12:00:01
huffingtonpost.ca, Wed Nov 26 17:42:53 2014 UTC, Reboot Of 'Reboot' Gets A Title. Yes This Is Really Happening, 70, /r/television, 2235, http://www.huffingtonpost.ca/2014/11/24/reboot-sequel-title-tv-show-cartoon_n_6214852.html, 448 comments, toronto34, 2014-11-27 12:00:01
i.imgur.com, Thu Nov 27 02:10:56 2014 UTC, Go fuck yourself San Andreas, 71, /r/gaming, 3158, http://i.imgur.com/fIotkVb.jpg, 233 comments, HelghanCosmos, 2014-11-27 12:00:01
i.imgur.com, Thu Nov 27 12:33:52 2014 UTC, Only in Canada, 72, /r/funny, 1893, http://i.imgur.com/Xi6zAaq.jpg, 85 comments, darkstar6988, 2014-11-27 12:00:01
self.tifu, Thu Nov 27 14:42:41 2014 UTC, TIFU by placing my free hand on my wifes bum, 73, /r/tifu, 112, /r/tifu/comments/2nkww0/tifu_by_placing_my_free_hand_on_my_wifes_bum/, 48 comments, Audifred6267, 2014-11-27 12:00:01
i.imgur.com, Thu Nov 27 12:48:07 2014 UTC, I don't think it goes there and I'm sorry it fits., 74, /r/funny, 1682, http://i.imgur.com/GhNituo.jpg, 58 comments, GovSchwarzenshnitzel, 2014-11-27 12:00:01
i.imgur.com, Thu Nov 27 07:43:01 2014 UTC, At first I thought it was a winter forest fire, 75, /r/pics, 4488, http://i.imgur.com/2MENHhS.jpg, 211 comments, 511100, 2014-11-27 12:00:01
i.imgur.com, Thu Nov 27 02:46:43 2014 UTC, House to myself tonight. About to start this for the first time, 76, /r/gaming, 2400, http://i.imgur.com/Dd9eZnX.jpg, 437 comments, JimeVR46, 2014-11-27 12:00:01
i.imgur.com, Thu Nov 27 04:52:05 2014 UTC, Valiant effort Turtle Beach., 77, /r/gaming, 1644, http://i.imgur.com/xujdtQI.jpg, 87 comments, PavlovGW, 2014-11-27 12:00:01
i.imgur.com, Thu Nov 27 08:50:32 2014 UTC, I have also made a table with axes for legs. I just had no idea that Reddit might care., 78, /r/pics, 3507, http://i.imgur.com/ZZm4PLc.jpg, 379 comments, Reymont, 2014-11-27 12:00:01
youtube.com, Thu Nov 27 13:54:38 2014 UTC, Placebo - The Bitter End [Alternative Rock], 79, /r/Music, 50, https://www.youtube.com/watch?v=IwNeir6cerc, 6 comments, TheEndHasNo___, 2014-11-27 12:00:01
i.imgur.com, Thu Nov 27 13:36:00 2014 UTC, How many lives does this guy have left?, 80, /r/gifs, 1096, http://i.imgur.com/OS2uRes.gif, 76 comments, I_love_moo, 2014-11-27 12:00:01
self.Futurology, Thu Nov 27 08:19:21 2014 UTC, So DARPA is going to build atom replicators (APM / Molecular Manufacturing) for ...2019 (Development starting in Mars 2015)., 81, /r/Futurology, 181, /r/Futurology/comments/2nk9pz/so_darpa_is_going_to_build_atom_replicators_apm/, 64 comments, Valmond, 2014-11-27 12:00:01
i.imgur.com, Thu Nov 27 13:56:57 2014 UTC, I Like This Kid, 82, /r/funny, 1231, http://i.imgur.com/u7vuupQ.png, 23 comments, Doctor_Heat, 2014-11-27 12:00:01
i.imgur.com, Thu Nov 27 14:28:36 2014 UTC, I made In-Law BINGO for thanksgiving, 83, /r/funny, 1104, http://i.imgur.com/mUWq2rJ.jpg, 96 comments, ilikegear, 2014-11-27 12:00:01
self.television, Wed Nov 26 20:22:18 2014 UTC, The show Bored to Death is awesome if you haven't seen it., 84, /r/television, 1046, /r/television/comments/2nidcu/the_show_bored_to_death_is_awesome_if_you_havent/, 154 comments, jphobbit, 2014-11-27 12:00:01
self.AskReddit, Thu Nov 27 12:59:22 2014 UTC, Doctors of reddit What goes through your head if a patient says he has looked up his symptoms online and is convinced by his own diagnosis?, 85, /r/AskReddit, 210, /r/AskReddit/comments/2nkpvj/doctors_of_reddit_what_goes_through_your_head_if/, 164 comments, amanhg, 2014-11-27 12:00:01
liveleak.com, Wed Nov 26 23:57:33 2014 UTC, Think CSI is bad? This is why I rage-quit watching Bones: the hand-carved computer virus., 86, /r/videos, 3727, http://www.liveleak.com/view?i=e27_1327440153&t=1, 1153 comments, Hibernian, 2014-11-27 12:00:01
self.WritingPrompts, Thu Nov 27 09:56:15 2014 UTC, [WP] The first astronauts on Mars find a crash site with the skelatized bodies of humans in futuristic space suits. A floppy disk is clenched in the hands of one of the deceased crew., 87, /r/WritingPrompts, 102, /r/WritingPrompts/comments/2nkff5/wp_the_first_astronauts_on_mars_find_a_crash_site/, 12 comments, SilentSamurai, 2014-11-27 12:00:01
imgur.com, Thu Nov 27 02:10:30 2014 UTC, I built a cedar strip canoe!, 88, /r/DIY, 435, http://imgur.com/a/HkfSO, 33 comments, n_nwkyle, 2014-11-27 12:00:01
i.imgur.com, Thu Nov 27 13:52:11 2014 UTC, Where can I apply?, 89, /r/funny, 1082, http://i.imgur.com/gz1haku.jpg, 80 comments, winter_storm, 2014-11-27 12:00:01
self.AskReddit, Thu Nov 27 04:05:56 2014 UTC, What's the best prank to slowly fuck with someone's mind over time?, 90, /r/AskReddit, 981, /r/AskReddit/comments/2njpbb/whats_the_best_prank_to_slowly_fuck_with_someones/, 1214 comments, 3genav, 2014-11-27 12:00:01
imgur.com, Wed Nov 26 23:37:45 2014 UTC, Good Guy Naughty Dog, 91, /r/gaming, 3317, http://imgur.com/mfijLop, 269 comments, vincent05pug, 2014-11-27 12:00:01
avclub.com, Thu Nov 27 14:31:03 2014 UTC, The Star Wars trailer will also be on iTunes so nobody has to go to the theater this weekend, 92, /r/movies, 108, http://www.avclub.com/article/star-wars-trailer-will-also-be-itunes-so-nobody-ha-212389, 44 comments, Sourcecode12, 2014-11-27 12:00:01
en.wikipedia.org, Thu Nov 27 12:41:09 2014 UTC, TIL that Jim Bowie after being shot and impaled by a sword after a duel disemboweled a local sheriff was shot and stabbed again and survived. For this reason the large knife he used in the fight is called a Bowie Knife., 93, /r/todayilearned, 898, http://en.wikipedia.org/wiki/James_Bowie#Land_speculator, 33 comments, Bruce_Wa7ne, 2014-11-27 12:00:01
i.imgur.com, Thu Nov 27 07:01:47 2014 UTC, The new Namaste skyscraper in Mumbai, 94, /r/pics, 3717, http://i.imgur.com/CJvoZAc.jpg, 749 comments, LazarGuitrWulvz, 2014-11-27 12:00:01
self.nosleep, Thu Nov 27 14:37:36 2014 UTC, An Illuminati Thanksgiving, 95, /r/nosleep, 14, /r/nosleep/comments/2nkwin/an_illuminati_thanksgiving/, 13 comments, conanfurter, 2014-11-27 12:00:01
youtube.com, Thu Nov 27 00:45:28 2014 UTC, They Might Be Giants - Ana Ng [Alternative Rock], 96, /r/Music, 409, https://www.youtube.com/watch?v=MEjutUbgpH8, 22 comments, MyAlarmClock, 2014-11-27 12:00:01
finance.yahoo.com, Thu Nov 27 11:39:26 2014 UTC, Walmart Workers Leave Food Donation Bin Outside Home of Walmart Heiress, 97, /r/news, 352, http://finance.yahoo.com/news/walmart-workers-leave-food-donation-000343313.html, 91 comments, greenirished, 2014-11-27 12:00:01
self.Showerthoughts, Thu Nov 27 08:19:14 2014 UTC, It's illegal for you to prove that I'm not immortal, 98, /r/Showerthoughts, 304, /r/Showerthoughts/comments/2nk9pn/its_illegal_for_you_to_prove_that_im_not_immortal/, 52 comments, UristMcWizard, 2014-11-27 12:00:01
imgur.com, Wed Nov 26 18:34:33 2014 UTC, Kevin Spacey is Airdropping me pictures of himself., 99, /r/creepy, 2077, http://imgur.com/a/r8mI0, 225 comments, ChrisH100, 2014-11-27 12:00:01
self.AskReddit, Thu Nov 27 02:14:59 2014 UTC, Teachers of Reddit what was the stupidest answer to a question that a student has ever said?, 100, /r/AskReddit, 1192, /r/AskReddit/comments/2njeum/teachers_of_reddit_what_was_the_stupidest_answer/, 2278 comments, spicyweiner1337, 2014-11-27 12:00:01
