domain,post_time,title,rank,subreddit,score,link,comments,submitter,timestamp
imgur.com,Sat Nov 15 16:28:03 2014 UTC,I see your Peruvian Morgan Freeman and raise you a Venezuelan Morgan Freeman,1,/r/funny,,http://imgur.com/PVaL5mU,160 comments,Seeker214,2014-11-15 13:00:01
youtu.be,Sat Nov 15 15:24:56 2014 UTC,Guy in DayZ stalkes players camping in the woods in the dead of night and scares the shit out of them using a predator soundboard,2,/r/gaming,3471,http://youtu.be/6Tg2XIDNnjQ,446 comments,kimjungfood,2014-11-15 13:00:01
i.imgur.com,Sat Nov 15 12:14:57 2014 UTC,I thought they were supposed to hate each other!,3,/r/aww,4497,http://i.imgur.com/8NMWJH7.jpg,273 comments,yummie4mytummie,2014-11-15 13:00:01
en.wikipedia.org,Sat Nov 15 12:24:32 2014 UTC,TIL: The UK Royal Mail ran an underground railway network in London of driverless trains from 1927 until 2003 to move mail between sorting offices,4,/r/todayilearned,3224,http://en.wikipedia.org/wiki/London_Post_Office_Railway,169 comments,moscag,2014-11-15 13:00:01
i.imgur.com,Sat Nov 15 12:12:30 2014 UTC,If only bananas had robust natural bio-degradable packaging of their own. Some sort of peelable skin perhaps.,5,/r/pics,3994,http://i.imgur.com/WPaVBTv.jpg?1?4876,546 comments,laser-eyes,2014-11-15 13:00:01
i.imgur.com,Sat Nov 15 12:37:53 2014 UTC,Trying to carry all the grocery bags at once,6,/r/gifs,3308,http://i.imgur.com/2oNaWWk.gif,351 comments,MariaJaimes,2014-11-15 13:00:01
theguardian.com,Sat Nov 15 09:23:58 2014 UTC,US president says every nation has a responsibility to do its part and overcome old divides look squarely at the science and reach a strong global climate agreement next year,7,/r/worldnews,3698,http://www.theguardian.com/world/2014/nov/15/barack-obama-tells-g20-a-global-climate-change-deal-is-possible-and-vital,956 comments,opnae77,2014-11-15 13:00:01
imgur.com,Sat Nov 15 10:24:04 2014 UTC,This plastic spoon has a built-in toothpick,8,/r/mildlyinteresting,3020,http://imgur.com/Eno9T3e,183 comments,unohoo09,2014-11-15 13:00:01
youtube.com,Sat Nov 15 12:09:53 2014 UTC,South Park's take on the alcohol marketing industry,9,/r/television,1893,https://www.youtube.com/watch?v=wF1E5ZO8Lug,227 comments,getoffmeowen123,2014-11-15 13:00:01
abc.net.au,Sat Nov 15 07:42:21 2014 UTC,After hearing a homeless man saying he was too smelly to eat with a bishop Pope Francis ordered the installation of showers for the homeless next to St Peter's Square,10,/r/news,3895,http://www.abc.net.au/news/2014-11-14/i-smell-confession-wins-homeless-right-to-papal-showers/5890412?WT.mc_id=Corp_News-Nov2014%7CNews-Nov2014_FBP%7Cabcnews,726 comments,Chrisortiz,2014-11-15 13:00:01
i.imgur.com,Sat Nov 15 13:07:59 2014 UTC,The best breakfast i ever had,11,/r/food,1256,http://i.imgur.com/iKnCQi7.jpg?1,139 comments,LikaShambooty,2014-11-15 13:00:01
self.tifu,Sat Nov 15 11:14:20 2014 UTC,TIFU by screwing my sister's future roomates,12,/r/tifu,1463,/r/tifu/comments/2mdeoi/tifu_by_screwing_my_sisters_future_roomates/,387 comments,sorrylilsis,2014-11-15 13:00:01
junkee.com,Sat Nov 15 10:40:19 2014 UTC,Male television host wears same suit for a year and goes unnoticed; aim was to make a point about sexism.,13,/r/TwoXChromosomes,1502,http://junkee.com/karl-stefanovic-has-worn-the-same-suit-every-day-for-a-year-because-sexism/45317,673 comments,HeHathADailyBeauty,2014-11-15 13:00:01
i.imgur.com,Sat Nov 15 11:59:36 2014 UTC,Properties currently for sale in Denmark [OC],14,/r/dataisbeautiful,1135,http://i.imgur.com/rIziFUE.jpg,101 comments,elongated_smiley,2014-11-15 13:00:01
self.science,Sat Nov 15 12:58:37 2014 UTC,Science AMA Series: We are SLAC National Accelerator Laboratory staff scientist Dr. Mike Litos and Stanford Ph.D. student Spencer Gessner our work was the topic of a popular reddit post about shrinking particle accelerators AMA,15,/r/science,924,/r/science/comments/2mdjzt/science_ama_series_we_are_slac_national/,89 comments,SLAC_National_Lab,2014-11-15 13:00:01
self.Showerthoughts,Sat Nov 15 13:56:23 2014 UTC,Me talking about my brain is my brain talking about itself in 3rd person.,16,/r/Showerthoughts,692,/r/Showerthoughts/comments/2mdnip/me_talking_about_my_brain_is_my_brain_talking/,48 comments,Capstf,2014-11-15 13:00:01
youtube.com,Sat Nov 15 08:44:17 2014 UTC,Incredible Japanese flip books,17,/r/videos,1522,https://www.youtube.com/watch?v=1e1GKG-Gmjk,61 comments,JapanGet,2014-11-15 13:00:01
i.imgur.com,Sat Nov 15 14:06:56 2014 UTC,Having your computer delivered in the 1950s,18,/r/OldSchoolCool,528,http://i.imgur.com/FR3qtXO.jpg,28 comments,riseoff_,2014-11-15 13:00:01
self.Jokes,Sat Nov 15 05:23:47 2014 UTC,Australia's smartest man,19,/r/Jokes,2536,/r/Jokes/comments/2mcui8/australias_smartest_man/,461 comments,Words_of_err_,2014-11-15 13:00:01
self.LifeProTips,Sat Nov 15 14:06:46 2014 UTC,LPT: If your job is monotonous isolate yourself from all time telling devices.,20,/r/LifeProTips,503,/r/LifeProTips/comments/2mdo7a/lpt_if_your_job_is_monotonous_isolate_yourself/,90 comments,Toxic_Badger,2014-11-15 13:00:01
i.imgur.com,Sat Nov 15 11:36:56 2014 UTC,PsBattle: Koala session at the G20 summit,21,/r/photoshopbattles,795,http://i.imgur.com/aUazUFA.jpg,53 comments,wakawaq,2014-11-15 13:00:01
theweek.com,Sat Nov 15 04:04:48 2014 UTC,Mall threatens to fine stores $200 an hour for being closed on Thanksgiving,22,/r/nottheonion,2488,http://theweek.com/speedreads/index/271965/speedreads-mall-threatens-to-fine-stores-200-an-hour-for-being-closed-on-thanksgiving,809 comments,SleepingInTheFlowers,2014-11-15 13:00:01
n4gm.com,Sat Nov 15 15:39:21 2014 UTC,Self-Taught Woodworker Turns Old Skateboards Into Beautiful Sculptures,23,/r/Art,302,http://n4gm.com/self-taught-woodworker-turns-old-skateboards-beautiful-sculptures/,13 comments,kratosmaycry,2014-11-15 13:00:01
i.imgur.com,Sat Nov 15 03:25:49 2014 UTC,Denali National Park Alaska. [OC] [3264x1836],24,/r/EarthPorn,2696,http://i.imgur.com/QLGEdyA.jpg?1,89 comments,MinerKing13,2014-11-15 13:00:01
imgur.com,Sat Nov 15 02:38:45 2014 UTC,Oscar Winners for Best Makeup and Hairstyling from 1981-2013 (None awarded for 1983),25,/r/movies,3026,http://imgur.com/a/CHDxI,436 comments,tyrellious,2014-11-15 13:00:01
vine.co,Sat Nov 15 05:28:26 2014 UTC,Utah college basketball player gets blocked,26,/r/sports,1732,https://vine.co/v/O5O23XurHgw,434 comments,DietDrMario,2014-11-15 13:00:01
self.explainlikeimfive,Sat Nov 15 10:50:07 2014 UTC,ELI5: Why does it cost so much to adopt children?,27,/r/explainlikeimfive,566,/r/explainlikeimfive/comments/2mddhk/eli5_why_does_it_cost_so_much_to_adopt_children/,272 comments,Mr_MittenstehAMAZING,2014-11-15 13:00:01
self.IAmA,Sat Nov 15 13:16:20 2014 UTC,Hello I'm Rob Sherman Game Designer and Writer-In-Residence at the British Library AMA,28,/r/IAmA,358,/r/IAmA/comments/2mdl1a/hello_im_rob_sherman_game_designer_and/,44 comments,bonfiredog,2014-11-15 13:00:01
self.personalfinance,Sat Nov 15 08:49:20 2014 UTC,60% of inherited fortunes do not survive the second generation and 90% the third.,29,/r/personalfinance,753,/r/personalfinance/comments/2md7q5/60_of_inherited_fortunes_do_not_survive_the/,288 comments,PieceAndLoaf,2014-11-15 13:00:01
twitter.com,Fri Nov 14 23:14:16 2014 UTC,Philae rotation successful! Philae rotated at 6:00pm (EST) in order to gain more sunlight exposure.,30,/r/space,3969,https://twitter.com/Philae2014/status/533393729156308992,715 comments,PanicFart,2014-11-15 13:00:01
self.creepy,Sat Nov 15 13:31:00 2014 UTC,So we found a secret note in the toy we bought for my daughter at target......,31,/r/creepy,275,/r/creepy/comments/2mdlxs/so_we_found_a_secret_note_in_the_toy_we_bought/,177 comments,s0berage,2014-11-15 13:00:01
theverge.com,Sat Nov 15 13:33:29 2014 UTC,Brain injury researcher Jonathan Wolpaw is developing a computer-brain interface system that allows people who are paralysed communicate with their loved ones through a computer screen,32,/r/Futurology,252,http://www.theverge.com/2014/11/14/7221215/typing-text-with-your-thoughts-translating-sign-language-with-a,9 comments,cryptoz,2014-11-15 13:00:01
i.imgur.com,Sat Nov 15 00:34:46 2014 UTC,[Image] Sometimes Nike gets it right,33,/r/GetMotivated,2594,http://i.imgur.com/FtP9WKD.jpg,98 comments,up_my_butt,2014-11-15 13:00:01
self.Music,Sat Nov 15 03:40:11 2014 UTC,Any fans of Blind Melon?,34,/r/Music,1436,/r/Music/comments/2mclym/any_fans_of_blind_melon/,443 comments,taxi7,2014-11-15 13:00:01
imgur.com,Sat Nov 15 04:30:46 2014 UTC,My Nightmare Before Christmas themed cupcake stand I made for my Halloween Wedding!,35,/r/DIY,1216,http://imgur.com/a/j7Hyz,79 comments,never0101,2014-11-15 13:00:01
self.WritingPrompts,Sat Nov 15 13:35:59 2014 UTC,[WP] Everyone only gets to lie three times in their life so they only do so when it's an absolute must. This is the story of how someone lied three times in one day.,36,/r/WritingPrompts,193,/r/WritingPrompts/comments/2mdm94/wp_everyone_only_gets_to_lie_three_times_in_their/,31 comments,laiktail,2014-11-15 13:00:01
self.books,Sat Nov 15 13:16:33 2014 UTC,Which fiction books best describe a specific topic (for example timetravel)?,37,/r/books,110,/r/books/comments/2mdl1p/which_fiction_books_best_describe_a_specific/,122 comments,XenonDown,2014-11-15 13:00:01
youtube.com,Sat Nov 15 07:57:54 2014 UTC,No Ordinary Genius BBC documentary about Richard Feynman physicist as told by his colleagues family and friends - and himself. (1993),38,/r/Documentaries,283,http://www.youtube.com/watch?v=Fzg1CU8t9nw,13 comments,davidreiss666,2014-11-15 13:00:01
self.Fitness,Sat Nov 15 15:57:51 2014 UTC,How to unload your deadlifts quickly and safely.,39,/r/Fitness,58,/r/Fitness/comments/2mdwlv/how_to_unload_your_deadlifts_quickly_and_safely/,23 comments,MarkRippetoesGlutes,2014-11-15 13:00:01
self.nosleep,Sat Nov 15 15:43:50 2014 UTC,My Mormon childhood trauma...,40,/r/nosleep,57,/r/nosleep/comments/2mdvfy/my_mormon_childhood_trauma/,10 comments,raynace,2014-11-15 13:00:01
self.askscience,Fri Nov 14 19:41:53 2014 UTC,Is there a limit to how many times you can gravity assist a space craft with one planet before it stops increasing its velocity?,41,/r/askscience,2142,/r/askscience/comments/2mb9cf/is_there_a_limit_to_how_many_times_you_can/,489 comments,adhding_nerd,2014-11-15 13:00:01
theatlantic.com,Sat Nov 15 10:48:07 2014 UTC,The Boy With the Lego Hand,42,/r/UpliftingNews,94,http://www.theatlantic.com/technology/archive/2014/11/the-boy-with-the-lego-hand/382637/,5 comments,BlankVerse,2014-11-15 13:00:01
spygoodies.com,Fri Nov 14 23:49:01 2014 UTC,Yoogo Self Defense Keychain,43,/r/gadgets,669,http://www.spygoodies.com/yoogo-self-defense-keychain/,589 comments,cirad,2014-11-15 13:00:01
youtube.com,Sat Nov 15 10:07:13 2014 UTC,The Ventures -- Suicide is Painless [70s Funk]. M*A*S*H meets James Brown,44,/r/listentothis,82,https://www.youtube.com/watch?v=iWxnQWvZztw,9 comments,the_traveler,2014-11-15 13:00:01
openculture.com,Fri Nov 14 19:41:35 2014 UTC,600 Free Philosophical eBooks,45,/r/philosophy,482,http://www.openculture.com/free_ebooks,52 comments,Proteusiq,2014-11-15 13:00:01
youtube.com,Sat Nov 15 02:28:59 2014 UTC,Awesome Japanese arcade machine!,46,/r/videos,4362,http://www.youtube.com/attribution_link?a=P8nyl4gcqqY&u=%2Fwatch%3Fv%3Di0OnmhhFk9g%26feature%3Dshare,1333 comments,Infernoo1717,2014-11-15 13:00:01
i.imgur.com,Sat Nov 15 13:32:59 2014 UTC,Having your computer delivered in the 1950s,47,/r/pics,2140,http://i.imgur.com/FR3qtXO.jpg,101 comments,riseoff_,2014-11-15 13:00:01
i.imgur.com,Sat Nov 15 10:54:32 2014 UTC,A Rainbow cricket.,48,/r/pics,3219,http://i.imgur.com/a3HIR2n.jpg,82 comments,forte2,2014-11-15 13:00:01
youtube.com,Sat Nov 15 13:17:22 2014 UTC,Guthrie Govan -- Wonderful Slippery Thing [fusion] (1993),49,/r/listentothis,38,https://www.youtube.com/watch?v=01gzVYDV5B8,6 comments,wisetom1,2014-11-15 13:00:01
online.wsj.com,Sat Nov 15 13:07:44 2014 UTC,John Cleese on Monty Python and the State of Comedy - WSJ,50,/r/books,88,http://online.wsj.com/articles/john-cleese-on-monty-python-and-the-state-of-comedy-1415991304?google_editors_picks=true,13 comments,TominatorXX,2014-11-15 13:00:01
youtube.com,Sat Nov 15 09:22:16 2014 UTC,Is the U.S. criminal justice system a crime against humanity? A discussion with Kit Wellman,51,/r/philosophy,30,https://www.youtube.com/watch?v=rvMLRPRMSMg,5 comments,Dylanhelloglue,2014-11-15 13:00:01
youtube.com,Sat Nov 15 14:39:15 2014 UTC,Portugal. The Man - So American [Indie Rock],52,/r/Music,141,https://www.youtube.com/watch?v=iKVA36in9AU,25 comments,liberttine,2014-11-15 13:00:01
self.tifu,Sat Nov 15 13:35:05 2014 UTC,TIFU by vacuuming my anus,53,/r/tifu,665,/r/tifu/comments/2mdm6v/tifu_by_vacuuming_my_anus/,131 comments,Myideasreallysuck,2014-11-15 13:00:01
i.imgur.com,Sat Nov 15 11:06:15 2014 UTC,Dog Has a Date,54,/r/gifs,2731,http://i.imgur.com/81HXziX.gif,73 comments,Lord-Brain,2014-11-15 13:00:01
m.imgur.com,Sat Nov 15 11:49:25 2014 UTC,This car's license plate is a picture of the car,55,/r/mildlyinteresting,1563,http://m.imgur.com/n2Oo4Lu,50 comments,spokensmoke,2014-11-15 13:00:01
academia.edu,Sat Nov 15 13:44:30 2014 UTC,Minoan Metal Vessel Manufacture: Reconstructing Techniques and Technology with Experimental Archaeology | Christina Clarke,56,/r/history,18,https://www.academia.edu/7761498/Minoan_Metal_Vessel_Manufacture_Reconstructing_Techniques_and_Technology_with_Experimental_Archaeology,1 comment,Thistleknot,2014-11-15 13:00:01
flavorwire.com,Sat Nov 15 15:05:36 2014 UTC,Lindsay Hunters Ugly Girls: Fiction and the Spectacle of Rural Poverty,57,/r/books,53,http://flavorwire.com/488577/lindsay-hunters-ugly-girls-fiction-and-the-spectacle-of-rural-poverty/,4 comments,zsreport,2014-11-15 13:00:01
self.books,Sat Nov 15 14:51:51 2014 UTC,What are some books that are easy to read & are extremely enjoyable/effective in doing so?,58,/r/books,55,/r/books/comments/2mdrby/what_are_some_books_that_are_easy_to_read_are/,58 comments,ronswansoneatssteak,2014-11-15 13:00:01
self.explainlikeimfive,Sat Nov 15 15:01:29 2014 UTC,ELI5: How are sociopaths able to have such magnetic personalities and appear likable when they have no empathy?,59,/r/explainlikeimfive,174,/r/explainlikeimfive/comments/2mds0p/eli5_how_are_sociopaths_able_to_have_such/,97 comments,CalvinHobb3s,2014-11-15 13:00:01
nytimes.com,Sat Nov 15 16:24:32 2014 UTC,Should the United States Declare Books an Essential Good?,60,/r/books,,http://www.nytimes.com/2014/11/16/books/review/should-the-united-states-declare-books-an-essential-good.html?_r=0,7 comments,jaysrapsleafs,2014-11-15 13:00:01
youtube.com,Sat Nov 15 15:51:31 2014 UTC,The Real Truth Behind Monster Energy,61,/r/videos,249,https://www.youtube.com/watch?v=knXtf-hjT4s,24 comments,Drollific,2014-11-15 13:00:01
self.IAmA,Sat Nov 15 16:37:07 2014 UTC,I am Jonathan Holmes new Editor in Chief of Destructoid: AMA!,62,/r/IAmA,,/r/IAmA/comments/2me040/i_am_jonathan_holmes_new_editor_in_chief_of/,96 comments,DtoidHolmes,2014-11-15 13:00:01
self.books,Sat Nov 15 15:30:01 2014 UTC,I don't read much anyway and I have a bad tendency not to finish books when I start them. So I decided to pick out twelve books and make it my goal to get them read within a year. Here's my list.,63,/r/books,46,/r/books/comments/2mdua9/i_dont_read_much_anyway_and_i_have_a_bad_tendency/,24 comments,CompanionCubeForever,2014-11-15 13:00:01
i.imgur.com,Sat Nov 15 10:56:46 2014 UTC,Picture by Norwegian nature photographer,64,/r/pics,2290,http://i.imgur.com/YpGNh06.jpg,59 comments,monster52,2014-11-15 13:00:01
self.history,Sat Nov 15 16:15:53 2014 UTC,Advice to a historian for their cover letter to a history curriculum company,65,/r/history,,/r/history/comments/2mdy7t/advice_to_a_historian_for_their_cover_letter_to_a/,comment,jedamitchell,2014-11-15 13:00:01
news.nationalgeographic.com,Sat Nov 15 13:31:09 2014 UTC,Autisms Gut-Brain Connection: The different gut bacteria in autistic individuals may be contributing to the disorder.,66,/r/science,464,http://news.nationalgeographic.com/news/2014/11/141114-autism-gut-brain-probiotic-research-biology-medicine-bacteria/#at_pco=cfd-1.0&at_ab=-&at_pos=0&at_tot=4&at_si=546754b1e9adef36,41 comments,NinjaDiscoJesus,2014-11-15 13:00:01
youtube.com,Sat Nov 15 14:04:54 2014 UTC,Happy Birthday -- Girls FM [indie/pop] (2010),67,/r/listentothis,23,https://www.youtube.com/watch?v=4QV1ZNrmAaw,2 comments,jancisl,2014-11-15 13:00:01
youtu.be,Sat Nov 15 12:25:59 2014 UTC,Mitchell and Webb's Kitchen Nightmares,68,/r/videos,407,http://youtu.be/i1NfWIaYed8,27 comments,Mr_Orange_Man,2014-11-15 13:00:01
self.books,Sat Nov 15 03:07:53 2014 UTC,Have you ever had an author write back to you? I found a neat little sci-fi book at a thrift shop and loved it so much I sent the author an e-mail. Her reply is one of the best e-mails I've ever received.,69,/r/books,380,/r/books/comments/2mcj2b/have_you_ever_had_an_author_write_back_to_you_i/,193 comments,cinnamondrink,2014-11-15 13:00:01
imgur.com,Sat Nov 15 13:40:58 2014 UTC,Built a Chest of Drawers for My Comic Book Collection (x-post from /r/comicbooks),70,/r/DIY,120,http://imgur.com/a/E5LLj,7 comments,open_mike,2014-11-15 13:00:01
imgur.com,Sat Nov 15 09:43:53 2014 UTC,This cat has a cat on it!,71,/r/pics,2590,http://imgur.com/Ve56AYf,65 comments,evilpandas99,2014-11-15 13:00:01
youtube.com,Sat Nov 15 14:46:29 2014 UTC,John Martyn -- Easy Blues 1973 [Folk Blues Jazz],72,/r/listentothis,16,https://www.youtube.com/watch?v=hamLeJGAWVs,1 comment,Mazzaykas,2014-11-15 13:00:01
i.imgur.com,Sat Nov 15 12:02:56 2014 UTC,I see your Asian Morgan Freeman and raise you a Peruvian Morgan Freeman,73,/r/funny,3208,http://i.imgur.com/8yWMdzm.jpg,164 comments,sjlearton,2014-11-15 13:00:01
self.history,Sat Nov 15 13:08:19 2014 UTC,Wanting a recommendation for a well balanced book on The Troubles,74,/r/history,15,/r/history/comments/2mdkk4/wanting_a_recommendation_for_a_well_balanced_book/,6 comments,bookstorecore,2014-11-15 13:00:01
youtube.com,Sat Nov 15 10:30:04 2014 UTC,Shellac -- This is a Picture [post hardcore] (1998),75,/r/listentothis,34,https://www.youtube.com/watch?v=_EerlE7_wz8,5 comments,boywonder5691,2014-11-15 13:00:01
youtube.com,Sat Nov 15 14:31:34 2014 UTC,Larytta -- Osama Obama [Electronic/Groovy] (2014),76,/r/listentothis,17,https://www.youtube.com/watch?v=0hA8Zs0VElM,2 comments,GiveThesePeople-Air,2014-11-15 13:00:01
independent.co.uk,Sat Nov 15 13:52:46 2014 UTC,Teacher killed and skinned rabbit in class to 'show children how meat is processed' - The US teacher could face disciplinary action after pupils were 'disturbed',77,/r/news,607,http://www.independent.co.uk/news/world/americas/teacher-killed-and-skinned-rabbit-in-class-to-show-children-how-meat-is-processed-9862636.html,244 comments,EightRoundsRapid,2014-11-15 13:00:01
historytoday.com,Sat Nov 15 14:12:47 2014 UTC,Ebola Plague and Border Control,78,/r/history,11,http://www.historytoday.com/blog/2014/11/ebola-plague-and-border-control,4 comments,marquis_of_chaos,2014-11-15 13:00:01
i.imgur.com,Sat Nov 15 13:02:32 2014 UTC,Feeding kittens is a messy business,79,/r/aww,1602,https://i.imgur.com/0H0I90o.jpg,45 comments,love_the_heat,2014-11-15 13:00:01
self.explainlikeimfive,Sat Nov 15 14:31:29 2014 UTC,ELI5: Why don't we just use Faraday Cages for deep space travel? To save explorers from radiation?,80,/r/explainlikeimfive,131,/r/explainlikeimfive/comments/2mdpuz/eli5_why_dont_we_just_use_faraday_cages_for_deep/,40 comments,MaloonsOreo,2014-11-15 13:00:01
winnipegfreepress.com,Sat Nov 15 15:47:13 2014 UTC,A groundbreaking study traces toxins from Alberta's oilsands to northern Alberta's wildlife vegetation and a cluster of cancer cases among First Nations in the region. Never heard of it? That's no surprise.,81,/r/science,258,http://www.winnipegfreepress.com/local/getting-the-word-out-282801621.html?cx_navSource=d-more-news&device=mobile,15 comments,pnewell,2014-11-15 13:00:01
streamnowtv.com,Sat Nov 15 09:17:39 2014 UTC,Site that organizes and streams indie films and web shows,82,/r/InternetIsBeautiful,95,http://streamnowtv.com,2 comments,vincentkeeping,2014-11-15 13:00:01
youtube.com,Sat Nov 15 12:52:31 2014 UTC,The Summer Of Rave 1989 (2006) - enjoyable documentary by the BBC on the development of rave culture in the United Kingdom during the summer of 1989.,83,/r/Documentaries,50,https://www.youtube.com/watch?v=A-XrlMpwEuM,8 comments,Jack-in-Aus,2014-11-15 13:00:01
i.imgur.com,Sat Nov 15 10:57:52 2014 UTC,Look how cute I am!,84,/r/aww,2231,http://i.imgur.com/84gLyeD.jpg,18 comments,yummie4mytummie,2014-11-15 13:00:01
gma.yahoo.com,Fri Nov 14 19:55:39 2014 UTC,3-Year-Old Girl Keeps Santa Claus Company at Indiana Restaurant,85,/r/UpliftingNews,639,https://gma.yahoo.com/3-old-girl-keeps-santa-claus-company-indiana-071155445--abc-news-topstories.html,47 comments,waterfreak,2014-11-15 13:00:01
reddit.com,Sat Nov 15 15:33:37 2014 UTC,Please join us at /r/AskHistorians for an AMA on the Sikh Empire: From Banda Singh Bahadur to Maharaja Duleep Singh,86,/r/history,10,http://www.reddit.com/r/AskHistorians/comments/2mdtx1/ama_sikh_empire_from_banda_singh_bahadur_to/,3 comments,Georgy_K_Zhukov,2014-11-15 13:00:01
self.Fitness,Sat Nov 15 02:36:28 2014 UTC,12 month progress,87,/r/Fitness,276,/r/Fitness/comments/2mcg6d/12_month_progress/,196 comments,Ithrowfootballs,2014-11-15 13:00:01
navalhistorypodcast.com,Sat Nov 15 15:19:19 2014 UTC,Naval History Podcast | with Buckner F. Melton Jr.,88,/r/history,8,http://navalhistorypodcast.com/,1 comment,BrianEDenton,2014-11-15 13:00:01
self.Showerthoughts,Sat Nov 15 01:53:29 2014 UTC,If abortion is legal but prostitution is not then a woman owns her uterus but the vagina belongs to the state.,89,/r/Showerthoughts,2633,/r/Showerthoughts/comments/2mccc5/if_abortion_is_legal_but_prostitution_is_not_then/,494 comments,dickballforeskin,2014-11-15 13:00:01
youtube.com,Sat Nov 15 03:13:44 2014 UTC,Two Australian guys win the mega jackpot in a Japanese arcade,90,/r/videos,1692,https://www.youtube.com/watch?v=i0OnmhhFk9g,358 comments,darcy010,2014-11-15 13:00:01
self.nosleep,Fri Nov 14 23:14:15 2014 UTC,Stranded in Hell,91,/r/nosleep,469,/r/nosleep/comments/2mbwve/stranded_in_hell/,55 comments,Unidentified_BA,2014-11-15 13:00:01
i.imgur.com,Sat Nov 15 14:08:06 2014 UTC,No homo,92,/r/funny,1661,http://i.imgur.com/RgD6r0j.jpg,77 comments,DannyD4rko,2014-11-15 13:00:01
i.imgur.com,Sat Nov 15 16:09:06 2014 UTC,I couldn't afford to not share this with you guys,93,/r/funny,,http://i.imgur.com/mHESsw2.jpg,42 comments,eyiankes,2014-11-15 13:00:01
artbooom.com,Sat Nov 15 14:04:55 2014 UTC,Twisted Disney Princesses Jeffrey Thomas,94,/r/Art,146,http://www.artbooom.com/twisted-disney-princesses-jeffrey-thomas/,19 comments,ethan_kahun,2014-11-15 13:00:01
youtube.com,Sat Nov 15 01:47:41 2014 UTC,The Dangers of Public Access TV,95,/r/videos,1923,https://www.youtube.com/watch?v=a_SF2p59aDY,130 comments,IfritTower,2014-11-15 13:00:01
youtube.com,Sat Nov 15 12:07:36 2014 UTC,The Jesus Lizard -- Mouth Breather [alt rock] (1991),96,/r/listentothis,18,https://www.youtube.com/watch?v=JoxXKKQYJYQ&list=RDJoxXKKQYJYQ,7 comments,boywonder5691,2014-11-15 13:00:01
self.nosleep,Fri Nov 14 19:17:15 2014 UTC,I was recently released from jail for a crime I did not commit.,97,/r/nosleep,831,/r/nosleep/comments/2mb6lc/i_was_recently_released_from_jail_for_a_crime_i/,169 comments,CBANDVB,2014-11-15 13:00:01
i.imgur.com,Sat Nov 15 14:12:07 2014 UTC,Made my first pot roast yesterday.,98,/r/food,352,http://i.imgur.com/Ddqx64r.jpg,22 comments,Johnmcguirk,2014-11-15 13:00:01
greybmusings.wordpress.com,Sat Nov 15 10:06:18 2014 UTC,Gesture and Expression Based Authentication of Sony,99,/r/Futurology,154,http://greybmusings.wordpress.com/2014/06/03/sony-forget-passwords-and-now-smile-to-unlock-your-smartphone/,41 comments,mig29k,2014-11-15 13:00:01
i.imgur.com,Sat Nov 15 14:57:21 2014 UTC,What do you see in the Mirror Professor Dumbledore?,100,/r/funny,1210,http://i.imgur.com/al2b7gk.jpg,15 comments,CyanogenHacker,2014-11-15 13:00:01
