domain,post_time,title,rank,subreddit,score,link,comments,submitter,timestamp
imgur.com,Sun Nov 16 16:30:46 2014 UTC,Clever billboard ads,1,/r/pics,3897,http://imgur.com/a/CVg5l,306 comments,iBleeedorange,2014-11-16 15:00:01
imgur.com,Sun Nov 16 14:27:22 2014 UTC,The wind made it own snowballs today in Norway.,2,/r/mildlyinteresting,4212,http://imgur.com/a/yTFCK,372 comments,dafaqau,2014-11-16 15:00:01
i.imgur.com,Sun Nov 16 14:07:03 2014 UTC,Street vendor in China saves the life of an infant plunging two storeys,3,/r/gifs,4050,http://i.imgur.com/IvtthUF.gif,647 comments,Amberg22,2014-11-16 15:00:01
i.imgur.com,Sun Nov 16 13:31:40 2014 UTC,She's not a cat or a dog but I think you'll like her.,4,/r/aww,4244,http://i.imgur.com/uGprLJb.jpg,356 comments,benief,2014-11-16 15:00:01
i.imgur.com,Sun Nov 16 14:06:16 2014 UTC,Saw this sign on my way to work.,5,/r/funny,3990,http://i.imgur.com/DwRY1q3.jpg,502 comments,Gohomeyourdrunk,2014-11-16 15:00:01
imgur.com,Sun Nov 16 15:19:53 2014 UTC,Behind the Box Office: Google conducted a study on how people research and choose the films they watch,6,/r/movies,2587,http://imgur.com/a/O7j2P,281 comments,vvyn,2014-11-16 15:00:01
i.imgur.com,Sun Nov 16 13:56:07 2014 UTC,Crowds for different competitive gaming events,7,/r/gaming,3288,http://i.imgur.com/7R94hue.jpg,2035 comments,samzeven23,2014-11-16 15:00:01
self.Showerthoughts,Sun Nov 16 13:14:08 2014 UTC,If the movie Yes Man was instead Yes Woman it probably would have just been a porno.,8,/r/Showerthoughts,2886,/r/Showerthoughts/comments/2mgot2/if_the_movie_yes_man_was_instead_yes_woman_it/,249 comments,LilaLancaster,2014-11-16 15:00:01
self.IAmA,Sun Nov 16 12:46:11 2014 UTC,Hi Im travelling to EVERY single country in the world in a single UNBROKEN JOURNEY without airplanes. Ask me anything!,9,/r/IAmA,3025,/r/IAmA/comments/2mgnby/hi_im_travelling_to_every_single_country_in_the/,2777 comments,onceuponasaga,2014-11-16 15:00:01
liveleak.com,Sun Nov 16 12:15:31 2014 UTC,What happens when you scream out your window in Sweden,10,/r/videos,3150,http://www.liveleak.com/view?i=c26_1357935775,975 comments,BuffPiggy,2014-11-16 15:00:01
self.explainlikeimfive,Sun Nov 16 16:08:21 2014 UTC,ELI5: Why do Jews not try to convert people like other Abrahamic religions? (Christianity Islam),11,/r/explainlikeimfive,1387,/r/explainlikeimfive/comments/2mh0sh/eli5_why_do_jews_not_try_to_convert_people_like/,897 comments,welluhthisisawkward,2014-11-16 15:00:01
i.imgur.com,Sun Nov 16 16:15:57 2014 UTC,PsBattle: This road rage face from the Oklahoma driver's ed manual,12,/r/photoshopbattles,1333,http://i.imgur.com/eVpPfNE.png,144 comments,5inthepink5inthepink,2014-11-16 15:00:01
smh.com.au,Sun Nov 16 15:34:51 2014 UTC,Vladimir Putin leaves G20 summit citing a need to catch up on sleep,13,/r/nottheonion,1377,http://www.smh.com.au/business/g20/vladimir-putin-leaves-g20-summit-citing-a-need-to-catch-up-on-sleep-20141116-11npvw.html,219 comments,Z3R0C001,2014-11-16 15:00:01
beijingtoday.com.cn,Sun Nov 16 09:13:22 2014 UTC,TIL a Chinese beggar whose hands were ruined in an explosion spent a decade designing a new type of two-handed calligraphy. The result was so impressive that Chinas largest font maker gave him a design contract with 50 years of royalties and helped to get him off the streets.,14,/r/todayilearned,4124,http://beijingtoday.com.cn/2011/10/typeface-design-contract-saves-beggar-streets/,411 comments,CorporalCuntWrecker,2014-11-16 15:00:01
bbc.co.uk,Sun Nov 16 09:24:15 2014 UTC,US hostage Peter Kassig 'killed by ISIS',15,/r/worldnews,3510,http://www.bbc.co.uk/news/world-middle-east-30073602,2244 comments,Oksastus,2014-11-16 15:00:01
self.AskReddit,Sun Nov 16 12:31:49 2014 UTC,What generic Reddit comment do you always downvote or upvote?,16,/r/AskReddit,1720,/r/AskReddit/comments/2mgmo3/what_generic_reddit_comment_do_you_always/,4228 comments,magikarpKO,2014-11-16 15:00:01
gfycat.com,Sun Nov 16 12:36:30 2014 UTC,Some days it's just not going to go in,17,/r/sports,1689,http://gfycat.com/RemarkableUltimateJay,156 comments,HMSInvincible,2014-11-16 15:00:01
stltoday.com,Sun Nov 16 11:38:13 2014 UTC,St. Louis woman sentenced 78 years in prison for waterboarding her children,18,/r/news,2019,http://www.stltoday.com/news/local/crime-and-courts/st-louis-woman-sentenced-years-in-prison-for-waterboarding-her/article_078697bb-8a60-5998-9f77-0a559e180325.html,366 comments,lemonpartyorganizer,2014-11-16 15:00:01
sutura.io,Sun Nov 16 13:55:10 2014 UTC,This Week in Science: A Successful Comet Landing Quantum Simulation Intergalactic Winds and More!,19,/r/Futurology,1195,http://sutura.io/wp-content/uploads/2014/11/Science_Nov16th_14.jpg,56 comments,Portis403,2014-11-16 15:00:01
inquisitr.com,Sun Nov 16 07:42:08 2014 UTC,Only A Fraction Of The Population Has The Genotype That Makes Moderate Alcohol Consumption Heart Healthy,20,/r/science,3415,http://www.inquisitr.com/1612099/only-a-fraction-of-the-population-has-the-genotype-that-makes-moderate-alcohol-consumption-heart-healthy/,489 comments,silence_hr,2014-11-16 15:00:01
i.imgur.com,Sun Nov 16 15:07:02 2014 UTC,First try at peppermint brownie cookies.,21,/r/food,792,http://i.imgur.com/6606VPI.jpg,37 comments,munleymun,2014-11-16 15:00:01
self.LifeProTips,Sun Nov 16 05:58:08 2014 UTC,LPT: Use the extension /html5 at the end of any youtube video to make it load as HTML5 instead of Flash! Much more efficient at loading videos and plays back more effectively! Or use https://www.youtube.com/html5 to automatically make ALL videos HTLM5!,22,/r/LifeProTips,4093,/r/LifeProTips/comments/2mg2ok/lpt_use_the_extension_html5_at_the_end_of_any/,509 comments,MCPE_Master_Builder,2014-11-16 15:00:01
washingtonpost.com,Sun Nov 16 09:00:22 2014 UTC,Bill Cosby refuses to address sexual assault allegations on NPR interview will no longer appear on David Lettermans show,23,/r/television,2124,http://www.washingtonpost.com/blogs/style-blog/wp/2014/11/15/bill-cosby-stays-silent-on-npr-interview-will-no-longer-on-appear-on-david-lettermans-show/,1354 comments,swaggyhamster,2014-11-16 15:00:01
self.tifu,Sun Nov 16 13:45:48 2014 UTC,TIFU by spraying a spider with cleaning products,24,/r/tifu,845,/r/tifu/comments/2mgqls/tifu_by_spraying_a_spider_with_cleaning_products/,210 comments,tetrameles,2014-11-16 15:00:01
mibreit.deviantart.com,Sun Nov 16 09:45:52 2014 UTC,German Alps [900 x 600] photo by mibreit,25,/r/EarthPorn,1701,http://mibreit.deviantart.com/art/A-Piece-of-Heaven-357105002,22 comments,potato99,2014-11-16 15:00:01
i.imgur.com,Sun Nov 16 16:23:03 2014 UTC,[Image] ..the beginning..,26,/r/GetMotivated,509,http://i.imgur.com/GQMJ6Ig.jpg,19 comments,Sumit316,2014-11-16 15:00:01
youtube.com,Sun Nov 16 08:18:18 2014 UTC,LCD Soundsystem - Dance Yrself Clean [Alternative Dance],27,/r/Music,1937,https://www.youtube.com/watch?v=BRkDyFQjbqY,183 comments,de1vos,2014-11-16 15:00:01
artbooom.com,Sun Nov 16 11:48:50 2014 UTC,92 Year Old Grandmother Creates Beautiful Complex Temari Balls,28,/r/Art,940,http://www.artbooom.com/92-year-old-grandmother-creates-amazingly-complex-temari-balls/,59 comments,ethan_kahun,2014-11-16 15:00:01
i.imgur.com,Sun Nov 16 05:23:06 2014 UTC,'50s pin up goddess Betty Brosmer (xpost /r/pinup),29,/r/OldSchoolCool,3042,http://i.imgur.com/OlkpFSS.png,245 comments,Pallas-Athena,2014-11-16 15:00:01
youtube.com,Sun Nov 16 09:53:21 2014 UTC,Imagine what could be done with a penny for NASA?,30,/r/space,1209,https://www.youtube.com/watch?v=moa-ies4bPw,137 comments,NinnyBoggy,2014-11-16 15:00:01
imgur.com,Sun Nov 16 15:29:51 2014 UTC,Devil Bank - image in the marble of a local bank. Rumor is they replaced the marble and the image returned.,31,/r/creepy,417,http://imgur.com/75qsE9h,44 comments,MyAccountForReddit,2014-11-16 15:00:01
dadaviz.com,Sun Nov 16 13:42:36 2014 UTC,Chickens Have Gotten Ridiculously Large Since The 50's [OC],32,/r/dataisbeautiful,488,http://dadaviz.com/i/1857,144 comments,rapgod89,2014-11-16 15:00:01
self.Jokes,Sun Nov 16 06:11:51 2014 UTC,A minister dies..,33,/r/Jokes,1797,/r/Jokes/comments/2mg3mg/a_minister_dies/,74 comments,Caffeineguy152,2014-11-16 15:00:01
terrybisson.com,Sun Nov 16 02:37:08 2014 UTC,An alien describing humans to another alien. Funniest thing I've read in a while.,34,/r/books,3184,http://www.terrybisson.com/page6/page6.html,531 comments,Terreras,2014-11-16 15:00:01
self.personalfinance,Sun Nov 16 09:26:20 2014 UTC,My boyfriend wants to buy a $35000 car while only making $32000. He won't listen when I tell him that's a terrible idea.,35,/r/personalfinance,879,/r/personalfinance/comments/2mge8o/my_boyfriend_wants_to_buy_a_35000_car_while_only/,924 comments,canIbuyACar,2014-11-16 15:00:01
theguardian.com,Sun Nov 16 16:25:30 2014 UTC,I carried his name on my body for nine years: the tattooed trafficking survivors reclaiming their past.,36,/r/TwoXChromosomes,229,http://www.theguardian.com/global-development/2014/nov/16/sp-the-tattooed-trafficking-survivors-reclaiming-their-past,39 comments,timdaw,2014-11-16 15:00:01
self.Fitness,Sun Nov 16 11:43:29 2014 UTC,How do athletes practice 5 days a week or more and still manage to recover in time for games?,37,/r/Fitness,419,/r/Fitness/comments/2mgkfz/how_do_athletes_practice_5_days_a_week_or_more/,273 comments,shameonyouz,2014-11-16 15:00:01
flatuicolors.com,Sun Nov 16 17:17:40 2014 UTC,Flat UI Colors,38,/r/InternetIsBeautiful,149,http://flatuicolors.com/#,27 comments,steckymc,2014-11-16 15:00:01
self.WritingPrompts,Sun Nov 16 06:34:36 2014 UTC,[WP] An undercover cop is given an obscure word or phrase to drop into conversation only if things go badly and the mission is aborted. However for some reason the natural flow of conversation with the people he's infiltrating makes it very hard to avoid saying it.,39,/r/WritingPrompts,967,/r/WritingPrompts/comments/2mg55p/wp_an_undercover_cop_is_given_an_obscure_word_or/,77 comments,mrguy08,2014-11-16 15:00:01
self.nosleep,Sun Nov 16 14:16:28 2014 UTC,The homeless are disappearing,40,/r/nosleep,153,/r/nosleep/comments/2mgsh9/the_homeless_are_disappearing/,21 comments,somethingstraange,2014-11-16 15:00:01
vimeo.com,Sun Nov 16 17:38:42 2014 UTC,An Inconvenient Innocence (2014) Study of prosecutorial abuse in the Duke Lacrosse case with references to similar cases in the South,41,/r/Documentaries,60,http://vimeo.com/111360899?email_id=Y2xpcF90cmFuc2NvZGVkfDcwY2RlZmRkMzhkNjYzZmU4ODhmNTU4MTYwYWYzNmQyOTEwfDM0MjU2Nzc0fDE0MTU1NzU0MjV8NzcwMQ%3D%3D&utm_campaign=7701&utm_medium=clip-transcode_complete-finished-20120100&utm_source=email,5 comments,QuasiParis,2014-11-16 15:00:01
youtu.be,Sun Nov 16 14:12:07 2014 UTC,Plasma Arch Speaker,42,/r/gadgets,78,http://youtu.be/lCmo5y4DqvU?t=36m33s,13 comments,freesodas,2014-11-16 15:00:01
theage.com.au,Sat Nov 15 20:59:59 2014 UTC,Cutting hair for the homeless boosts mindsets and images,43,/r/UpliftingNews,1602,http://www.theage.com.au/national/cutting-hair-for-the-homeless-boosts-mindsets-and-images-20141113-11m2ar.html,97 comments,Sariel007,2014-11-16 15:00:01
unrv.com,Sun Nov 16 18:30:16 2014 UTC,The Cult Of Isis [Ancient Mediterranean],44,/r/history,,http://www.unrv.com/culture/isis.php,5 comments,Thistleknot,2014-11-16 15:00:01
epictetan.org,Sun Nov 16 03:33:11 2014 UTC,Epictetus: Before you wish for world peace look for inner peace.,45,/r/philosophy,274,http://www.epictetan.org/epictetus-blog/before-you-wish-for-world-peace-look-for-inner-peace,76 comments,sonshicom,2014-11-16 15:00:01
youtube.com,Sun Nov 16 16:06:14 2014 UTC,Worm Is Green -- Optimistic [ambient/trip hop],46,/r/listentothis,27,https://www.youtube.com/watch?v=hHcr4bo97qs,comment,eonomine,2014-11-16 15:00:01
i.imgur.com,Sun Nov 16 14:30:29 2014 UTC,First fire of the season!,47,/r/aww,3349,http://i.imgur.com/dJQGHK4.jpg,65 comments,mrwillya,2014-11-16 15:00:01
self.askscience,Sun Nov 16 17:06:01 2014 UTC,Will we ever be able to view what happens in other planets at a surface level with a powerful enough telescope?Especially planets that are earth-like/inhabitable.,48,/r/askscience,56,/r/askscience/comments/2mh61g/will_we_ever_be_able_to_view_what_happens_in/,9 comments,Andress1,2014-11-16 15:00:01
i.imgur.com,Sun Nov 16 16:27:15 2014 UTC,I made a Simpsons Donut cake for my girlfriends birthday today. She's a huge fan obviously!,49,/r/food,602,http://i.imgur.com/wRtjsjF.jpg,29 comments,aymanalien,2014-11-16 15:00:01
thinksteroids.com,Sun Nov 16 14:08:31 2014 UTC,TIL that in 2009 a Belgian bodybuilding championship was canceled after doping officials arrived unannounced and all the competitors fled,50,/r/todayilearned,1599,https://thinksteroids.com/news/2009-nabba-belgium-nationals-cancelled-after-steroid-testers-surprise-competitors/,46 comments,marmots_are_badass,2014-11-16 15:00:01
en.wikipedia.org,Sun Nov 16 14:38:09 2014 UTC,TIL that the SEGA chant at the beginning of Sonic the Hedgehog took up 1/8th of the memory on the cartridge.,51,/r/todayilearned,1444,http://en.wikipedia.org/wiki/Sonic_the_Hedgehog_(1991_video_game)#Development,87 comments,Zedfightsganon,2014-11-16 15:00:01
imgur.com,Sun Nov 16 16:23:04 2014 UTC,Honeycomb mirror top accent table (x-post r/woodworking),52,/r/DIY,55,http://imgur.com/a/HSmA5,5 comments,delta5,2014-11-16 15:00:01
i.imgur.com,Sun Nov 16 13:46:12 2014 UTC,Cato has forgotten how to dog...,53,/r/aww,3300,http://i.imgur.com/Pfs7cIG.jpg,111 comments,nightshadeNOLA,2014-11-16 15:00:01
imgur.com,Sun Nov 16 13:52:44 2014 UTC,Expensive restaurants are like...,54,/r/funny,2859,http://imgur.com/VRzxrh9,499 comments,ffaaii,2014-11-16 15:00:01
i.imgur.com,Sun Nov 16 13:19:47 2014 UTC,Radical Islam,55,/r/funny,3079,http://i.imgur.com/ZUwhYzY.jpg,75 comments,Dex22er,2014-11-16 15:00:01
i.imgur.com,Sun Nov 16 15:05:53 2014 UTC,Empty Nest Syndrome has been hard on both of us since our youngest son moved out and started college - but I suppose we're muddling through somehow.,56,/r/pics,4140,http://i.imgur.com/5jFsrNf.jpg,1224 comments,Ken_Thomas,2014-11-16 15:00:01
bcove.me,Sun Nov 16 15:07:37 2014 UTC,Actors Outraged Over Portrayal in Drunk Girl Video,57,/r/videos,1405,http://bcove.me/xank9u0p,221 comments,Skreamie,2014-11-16 15:00:01
nber.org,Sun Nov 16 17:03:36 2014 UTC,TIL indoor prostitution was legal in Rhode Island from 2003 to 2009. During those years reports of rape dropped by 31% and female gonorrhea cases dropped by 39% according to a study done by the National Bureau of Economic Research.,58,/r/todayilearned,783,http://www.nber.org/papers/w20281,43 comments,relevantlife,2014-11-16 15:00:01
i.imgur.com,Sun Nov 16 16:26:02 2014 UTC,I told the kids to go get dressed so we could go to the store,59,/r/funny,1721,http://i.imgur.com/MeboKEt.jpg,70 comments,ahhvey,2014-11-16 15:00:01
youtube.com,Sun Nov 16 13:56:44 2014 UTC,A squirrel nabbed my GoPro and carried it up a tree (and then dropped it),60,/r/funny,2626,https://www.youtube.com/watch?v=4_gmkhE7YQc,163 comments,freeyorker,2014-11-16 15:00:01
i.imgur.com,Sun Nov 16 16:13:59 2014 UTC,The difference between Doctor Who and Scooby Doo...,61,/r/funny,1738,http://i.imgur.com/hwXPULR.jpg,39 comments,MintyTyrant,2014-11-16 15:00:01
hurriyetdailynews.com,Sun Nov 16 12:30:29 2014 UTC,Scottish cyclist interrupts world tour to save stray dog.,62,/r/UpliftingNews,66,http://www.hurriyetdailynews.com/in-photos-scottish-cyclist-interrupts-world-tour-to-save-stray-dog.aspx?pageID=517&nID=74378&NewsCatID=341,3 comments,trumpetsofjericho,2014-11-16 15:00:01
self.AskReddit,Sun Nov 16 14:19:44 2014 UTC,What lesson or moral were you taught as a child that has stayed with you forever?,63,/r/AskReddit,861,/r/AskReddit/comments/2mgsnu/what_lesson_or_moral_were_you_taught_as_a_child/,1284 comments,bfsfan101,2014-11-16 15:00:01
archive.org,Sun Nov 16 10:18:26 2014 UTC,TIL that due to the Doppler effect a musical piece being emitted from a source traveling twice the speed of sound would be heard in correct time and tune but backwards.,64,/r/todayilearned,2303,http://archive.org/stream/theorysound02raylgoog#page/n176/mode/2up,154 comments,hauntedfox,2014-11-16 15:00:01
blogs.esa.int,Sun Nov 16 16:09:47 2014 UTC,Philae spotted after first landing on 67P,65,/r/space,264,http://blogs.esa.int/rosetta/2014/11/16/philae_spotted_after_first_landing/,11 comments,observingspace,2014-11-16 15:00:01
i.imgur.com,Sun Nov 16 14:46:59 2014 UTC,I may not be raising the smartest dog in the world.,66,/r/funny,1979,http://i.imgur.com/2ynEpJm.jpg,53 comments,ernieblunt,2014-11-16 15:00:01
youtu.be,Sun Nov 16 04:42:21 2014 UTC,Hosoo Transmongolia -- The Shaman From Northern Mongolia [Mongolian Folk],67,/r/listentothis,135,http://youtu.be/GsGMOunRt4Q,21 comments,KungFuGenius,2014-11-16 15:00:01
youtube.com,Sun Nov 16 14:55:26 2014 UTC,Moto Boy -- It Was Always You [Chilled] (2014),68,/r/listentothis,22,https://www.youtube.com/watch?v=OwPRB2nrx2M,8 comments,orbitalia,2014-11-16 15:00:01
i.imgur.com,Sun Nov 16 18:06:45 2014 UTC,I went to my husband's work today this was the first thing I noticed. He works at a military base.,69,/r/funny,,http://i.imgur.com/omzW3fk.jpg,96 comments,fonzysaysbecool,2014-11-16 15:00:01
youtube.com,Sun Nov 16 10:49:45 2014 UTC,TIL Charles Ingram cheated on Who Wants to Be A Millionaire and won the 1000000 prize. During the recording it was noticed that a suspicious pattern of coughing could be heard.,70,/r/todayilearned,1871,https://www.youtube.com/watch?v=cOBXeB6Q5Jk,215 comments,Frosssty,2014-11-16 15:00:01
openculture.com,Sun Nov 16 18:55:24 2014 UTC,110 Free Philosophy eBooks,71,/r/philosophy,,http://www.openculture.com/free-philosophy-ebooks,1 comment,burtzev,2014-11-16 15:00:01
imgur.com,Sun Nov 16 16:19:38 2014 UTC,Happy 62nd Birthday to Shigeru Miyamoto (Creator of Super Mario Bros  Legend of Zelda and many more beloved Nintendo franchises),72,/r/gaming,1191,http://imgur.com/gallery/b8YHVyQ,53 comments,Rmaan,2014-11-16 15:00:01
en.wikipedia.org,Sun Nov 16 12:23:42 2014 UTC,TIL: Older generation spy satellites predated any form of digital imaging by decades. They literally exposed film and dropped it back to earth in small re-entry pods.,73,/r/todayilearned,1335,http://en.wikipedia.org/wiki/KH-9_Hexagon,63 comments,kuberkoos,2014-11-16 15:00:01
i.imgur.com,Sun Nov 16 12:28:35 2014 UTC,Cut it here,74,/r/funny,2428,http://i.imgur.com/sRABG8C.jpg,201 comments,Dariu5V,2014-11-16 15:00:01
i.imgur.com,Sun Nov 16 13:43:19 2014 UTC,This is the most satisfied seal I've ever seen,75,/r/pics,3125,http://i.imgur.com/zGHNzyG.jpg,122 comments,Mictlantecuhtli,2014-11-16 15:00:01
bigthink.com,Sun Nov 16 03:42:28 2014 UTC,I think that philosophy of science is at its best and at its most exciting at historical moments when it's not so easy to distinguish between the activities of certain kinds of theoretical physicists and the activities of certain kinds of philosophers. David Albert's interview at Big Think,76,/r/philosophy,140,http://bigthink.com/videos/big-think-interview-with-david-albert,7 comments,LiterallyAnscombe,2014-11-16 15:00:01
self.Fitness,Sun Nov 16 17:01:53 2014 UTC,Check out Ilya Ilyins 242kg Clean and Jerk World Record in slow motion!,77,/r/Fitness,83,/r/Fitness/comments/2mh5nw/check_out_ilya_ilyins_242kg_clean_and_jerk_world/,19 comments,Rhomu,2014-11-16 15:00:01
imgur.com,Sun Nov 16 14:50:59 2014 UTC,Look at his little chubby rolls!,78,/r/aww,1604,http://imgur.com/g2IlDFu,26 comments,Solaire-Lives,2014-11-16 15:00:01
i.imgur.com,Sun Nov 16 14:48:28 2014 UTC,This time I ain't even mad.,79,/r/pics,2399,http://i.imgur.com/ct0ipBp.jpg,119 comments,k-roc24,2014-11-16 15:00:01
fastcoexist.com,Sun Nov 16 01:48:48 2014 UTC,This Punching Bag Computer Requires A Full-Body Workout If You Want To Type A Word,80,/r/gadgets,375,http://www.fastcoexist.com/3038197/this-punching-bag-computer-requires-a-full-body-workout-if-you-want-to-type-a-word?utm_source,72 comments,yourbasicgeek,2014-11-16 15:00:01
self.AskReddit,Sun Nov 16 14:03:20 2014 UTC,[Serious]What professions will be highly valuable 5 years from now?,81,/r/AskReddit,594,/r/AskReddit/comments/2mgrow/seriouswhat_professions_will_be_highly_valuable_5/,1009 comments,Dinosaur_Supervisor,2014-11-16 15:00:01
i.imgur.com,Sun Nov 16 12:14:28 2014 UTC,Vodka,82,/r/funny,2119,http://i.imgur.com/HxXNASw.jpg,67 comments,_wolfdale,2014-11-16 15:00:01
imgur.com,Sun Nov 16 16:52:37 2014 UTC,Adarsh Balak (ideal boy) comics from India,83,/r/funny,908,https://imgur.com/a/b2JTU,41 comments,lazyass_tiger,2014-11-16 15:00:01
imgur.com,Sun Nov 16 10:15:31 2014 UTC,I feel like homer a lot sometimes...,84,/r/funny,2983,http://imgur.com/ehA3hGi,41 comments,imtoophilosophical,2014-11-16 15:00:01
fullcomment.nationalpost.com,Sun Nov 16 00:00:34 2014 UTC,The improbable rise and violent fall of Austria-Hungary,85,/r/history,399,http://fullcomment.nationalpost.com/2014/11/14/geoffrey-wawro-the-improbable-rise-and-violent-fall-of-austria-hungary/,26 comments,nimobo,2014-11-16 15:00:01
washingtonpost.com,Sun Nov 16 15:31:05 2014 UTC,D.C. police plan for future seizure proceeds years in advance in city budget documents,86,/r/news,433,http://www.washingtonpost.com/investigations/dc-police-plan-for-future-seizure-proceeds-years-in-advance-in-city-budget-documents/2014/11/15/7025edd2-6b76-11e4-b053-65cea7903f2e_story.html,61 comments,HeLMeT_Ne,2014-11-16 15:00:01
i.imgur.com,Sun Nov 16 12:49:13 2014 UTC,The four elements,87,/r/funny,1815,http://i.imgur.com/KqW6PJm.jpg,93 comments,winter_storm,2014-11-16 15:00:01
self.Jokes,Sun Nov 16 15:00:15 2014 UTC,The CIA The Mossad and The KGB.,88,/r/Jokes,152,/r/Jokes/comments/2mgvck/the_cia_the_mossad_and_the_kgb/,5 comments,I_Not_A_Nice_Person,2014-11-16 15:00:01
i.imgur.com,Sun Nov 16 11:04:13 2014 UTC,I don't like Japanese subway now,89,/r/creepy,393,http://i.imgur.com/HJpTATd.gif,41 comments,Fckthsht,2014-11-16 15:00:01
i.imgur.com,Sun Nov 16 15:18:38 2014 UTC,In case of emergency,90,/r/funny,1120,http://i.imgur.com/oAcZVCz.jpg?1,31 comments,Go_Buds_Go,2014-11-16 15:00:01
en.wikipedia.org,Sun Nov 16 13:31:18 2014 UTC,TIL the film Lord of War (2005) was officially endorsed by the human rights group Amnesty International for highlighting the arms trafficking by the international arms industry,91,/r/todayilearned,768,http://en.wikipedia.org/wiki/Lord_of_War,28 comments,Jayskes,2014-11-16 15:00:01
i.imgur.com,Sun Nov 16 14:31:09 2014 UTC,My first week in a new job.,92,/r/funny,1250,http://i.imgur.com/NH9hh0N.jpg,15 comments,paraffintrippin,2014-11-16 15:00:01
imgur.com,Sun Nov 16 13:04:19 2014 UTC,My dog thinks he's a person. SO went to work early and I woke up to this.,93,/r/aww,1784,http://imgur.com/5mDT3qQ,27 comments,Vivalalilian,2014-11-16 15:00:01
cbc.ca,Sun Nov 16 15:30:42 2014 UTC,Military veteran pulled over while part of funeral procession for fellow soldier and given a $230 ticket on Remembrance day,94,/r/news,404,http://www.cbc.ca/news/canada/british-columbia/veteran-ticketed-escorting-body-of-private-steven-allen-1.2835893,130 comments,lemonpartyorganizer,2014-11-16 15:00:01
en.wikipedia.org,Sun Nov 16 12:42:55 2014 UTC,TIL an influential Islamic philosophical movement in 8th century Iraq declared the perfect human to be of Persian derivation Arabic faith Hebrew in astuteness a disciple of Christ in conduct as pious as a Syrian monk a Greek in natural sciences an Indian in the interpretation of mysteries.,95,/r/todayilearned,849,https://en.wikipedia.org/wiki/Brethren_of_Purity#The_Epistles_of_the_Brethren_of_Purity,56 comments,DigitalNomads,2014-11-16 15:00:01
travelphotoadventures.com,Sun Nov 16 11:41:54 2014 UTC,Evergreen Mountain Lookout Sunset in Washington. Photo by Michael Matti [25001666],96,/r/EarthPorn,461,http://www.travelphotoadventures.com/wp-content/uploads/2013/08/Evergreen-Mountain-Lookout-Sunset-by-Michael-Matti.jpg,9 comments,GerDexter,2014-11-16 15:00:01
self.Jokes,Sun Nov 16 16:26:50 2014 UTC,It was my son's birthday so I took 4 of his mates for a burger and then bowling.,97,/r/Jokes,106,/r/Jokes/comments/2mh2gr/it_was_my_sons_birthday_so_i_took_4_of_his_mates/,12 comments,onlywookie,2014-11-16 15:00:01
imgur.com,Sun Nov 16 13:25:52 2014 UTC,Cats Then and Now,98,/r/funny,1416,http://imgur.com/f6BKJWA,28 comments,nicedice02,2014-11-16 15:00:01
lastwordonnothing.com,Sun Nov 16 17:56:59 2014 UTC,TIL that to eliminate all the elusive invasive goats in the Galapagos researchers attached a radio-collar to a 'Judas goat' who would because of its gregarious nature seek out other goats. It was then tracked down the group killed but with the 'traitor' left alive in order to find more goats.,99,/r/todayilearned,315,http://www.lastwordonnothing.com/2012/07/16/galapagos-monday-the-judas-goat/,28 comments,DonTago,2014-11-16 15:00:01
imgur.com,Sun Nov 16 13:50:51 2014 UTC,Our 2-month-old rescued puppy Oreo found my nephew's pacifier lying around...,100,/r/aww,1426,http://imgur.com/a/ElHNF,13 comments,Caligo91,2014-11-16 15:00:01
